doi;title;language;language_detected;ambito_reale;ambito_detected;access_right;license;formati;star;volume;updated
10.5281/zenodo.3731521;Raw diffraction data for structure of SARS-CoV-2 main protease with PCM-0102121 (ID: mpro-x1402 / PDB: 5RFU);;en;non definito;non definito;open;CC0-1.0;zip;non classificabile;5900474968;2020-03-30
10.5281/zenodo.3731531;Raw diffraction data for structure of SARS-CoV-2 main protease with PCM-0102306 (ID: mpro-x1412 / PDB: 5RFV);;en;non definito;non definito;open;CC0-1.0;zip;non classificabile;6113951370;2020-03-30
10.5281/zenodo.3731535;Raw diffraction data for structure of SARS-CoV-2 main protease with PCM-0102243 (ID: mpro-x1418 / PDB: 5RFW);;en;non definito;non definito;open;CC0-1.0;zip;non classificabile;3518642330;2020-03-30
10.5281/zenodo.3731539;Raw diffraction data for structure of SARS-CoV-2 main protease with PCM-0102254 (ID: mpro-x1425 / PDB: 5RFX);;en;non definito;non definito;open;CC0-1.0;zip;non classificabile;6704250730;2020-03-30
10.5281/zenodo.3731542;CORD-19_ scite_citation_tallies+contexts;eng;en;non definito;non definito;open;CC-BY-4.0;csv;3_star;640966836714;2020-03-28
10.5281/zenodo.3731546;Raw diffraction data for structure of SARS-CoV-2 main protease with PCM-0102974 (ID: mpro-x1458 / PDB: 5RFY);;en;non definito;non definito;open;CC0-1.0;zip;non classificabile;6733175490;2020-03-30
10.5281/zenodo.3731550;Raw diffraction data for structure of SARS-CoV-2 main protease with PCM-0102274 (ID: mpro-x1478 / PDB: 5RFZ);;en;non definito;non definito;open;CC0-1.0;zip;non classificabile;4044397980;2020-03-30
10.5281/zenodo.3731556;Raw diffraction data for structure of SARS-CoV-2 main protease with PCM-0102535 (ID: mpro-x1493 / PDB: 5RG0);;en;non definito;non definito;open;CC0-1.0;zip;non classificabile;6216971409;2020-03-30
10.5281/zenodo.3732359;Training data for 'Unicycler assembly of SARS-CoV-2 genome with preprocessing to remove human genome reads' tutorial (Galaxy Training Material);eng;en;non definito;non definito;open;CC-BY-4.0;gz;non classificabile;2030396063612;2020-04-17
10.5281/zenodo.3732377;Mapping the COVID-19 global response: from grassroots to governments;eng;low confidence;non definito;non definito;open;other-pd;csv,ods,pdf,png,xlsx;3_star;79527268;2020-04-06
10.5281/zenodo.3733256;Adjoint-based Data Assimilation of an Epidemiology Model for the Covid-19 Pandemic in 2020 --- Data Files;;low confidence;non definito;non definito;open;CC-BY-4.0;csv,pdf;3_star;10080607;2020-04-24
10.5281/zenodo.3733554;covid-19_global_spread;eng;en;ambito epidemiologico;ambito genomico   ;open;CC-BY-4.0;csv;3_star;1078160;2020-03-31
10.5281/zenodo.3737839;Corresponding spreadsheet to the Paper 'The efficiency in the ordinary hospital bed management: A comparative analysis in four European countries before the COVID-19 outbreak';eng;en;non definito;non definito;open;CC-BY-4.0;xlsx;2_star;2196060;2021-03-11
10.5281/zenodo.3737840;Corresponding spreadsheet to the Paper 'Hospital intensive care unit bed management in Italy';eng;en;non definito;non definito;open;CC-BY-4.0;xlsx;2_star;110997642;2020-04-02
10.5281/zenodo.3739071;SARS-CoV-2 in vero cells, no quantitation, slices 1-10 of 20 CHYMOTRYPSIN digested;;en;non definito;non definito;open;CC-BY-4.0;raw;non classificabile;167786070168;2021-03-13
10.5281/zenodo.3739280;SARS-CoV-2 in vero cells, no quantitation, slices 11-20 of 20 CHYMOTRYPSIN digested;;en;non definito;non definito;open;CC-BY-4.0;raw;non classificabile;142836134672;2021-03-13
10.5281/zenodo.3739601;EMERGENCE OF DRIFT VARIANTS THAT MAY AFFECT COVID-19 VACCINE DEVELOPMENT AND ANTIBODY TREATMENT;;low confidence;non definito;non definito;open;CC-BY-4.0;zip;non classificabile;303372;2020-04-04
10.5281/zenodo.3741832;Data of correlation of COVID-19 cases/deaths and the Gold price;;en;ambito epidemiologico;ambito informatico   ;open;CC-BY-4.0;zip;non classificabile;187823223;2020-04-20
10.5281/zenodo.3742219;Curation and ISA representation of a SARS-Cov2/Covid-19 Proteomics Dataset - PXD107710 - ISA representation;eng;low confidence;non definito;non definito;open;CC-BY-3.0;tgz;trascurato;165861253093;2020-04-07
10.5281/zenodo.3743278;Dataset with Curated Coronavirus-related R&D Outputs (1970 - March 2020);eng;low confidence;non definito;non definito;open;CC-BY-4.0;zip;non classificabile;340232379;2020-04-08
10.5281/zenodo.3746584;Illumina reads SARS-Cov-2 using amplicon enrichment;;en;ambito informatico;ambito genomico   ;open;CC-BY-4.0;bed,fasta,gz;3_star;5467219868;2020-04-14
10.5281/zenodo.3746892;All Atom Molecular Dynamics Simulations of Ritonavir at the Binding Pocket of SARS-CoV2 Main Protease;;en;ambito genomico;ambito genomico   ;open;CC-BY-4.0;pdb;3_star;172318700472;2020-04-10
10.5281/zenodo.3747299;G7 Economics News related with Coronavirus (COVID-19);eng;low confidence;non definito;non definito;open;CC-BY-4.0;csv;3_star;214539;2020-04-14
10.5281/zenodo.3747336;Single cell and immune repertoire profiling of COVID-19 patients reveal novel therapeutic candidates;;en;ambito genomico;ambito genomico   ;open;CC-BY-4.0;gz,rds,txt;1_star;245945111255;2020-04-10
10.5281/zenodo.3747621;SIRAH-CoV2  initiative:  RNA binding domain of nucleocapsid phosphoprotein  (PDB id:6VYO);eng;low confidence;non definito;non definito;open;CC-BY-4.0;tar;3_star;239229232520;2021-01-13
10.5281/zenodo.3747902;Web Scrap of main informations on COVID 19 macro data per country;eng;low confidence;non definito;non definito;open;CC-BY-4.0;csv;3_star;5333460;2020-04-11
10.5281/zenodo.3748120;Dataset for Intervention strategies against COVID-19 and their estimated impact on Swedish healthcare capacity;;en;non definito;non definito;open;CC-BY-NC-ND-4.0;zip;non classificabile;9351131088;2020-04-14
10.5281/zenodo.3748659;SIRAH-CoV2  initiative: NSP15 Endonuclease  (PDB id:6W01);eng;low confidence;non definito;non definito;open;CC-BY-4.0;tar;3_star;576606484480;2021-01-13
10.5281/zenodo.3748665;SIRAH-CoV2  initiative:  Main Protease   (PDB id:6LU7);eng;low confidence;non definito;non definito;open;CC-BY-4.0;tar;3_star;825539386880;2021-01-13
10.5281/zenodo.3748694;Knowledge Graph about altmetrics of selected papers about COVID-19;;en;non definito;non definito;open;CC-BY-4.0;gz;non classificabile;1353814;2020-04-14
10.5281/zenodo.3748827;Dataset Casos COVID-19 por paises;;es;non definito;non definito;open;CC-BY-4.0;csv;3_star;689852;2020-04-12
10.5281/zenodo.3749226;dataset Covid-19;;es;non definito;non definito;open;CC-BY-4.0;csv;3_star;1623683;2020-04-14
10.5281/zenodo.3749286;Cruce de casos por Coronavirus con el PIB Per Cápita Mundial;spa;es;non definito;non definito;open;CC-BY-NC-SA-4.0;csv;3_star;889455;2020-04-14
10.5281/zenodo.3749290;Air contamination and covid-19 cases in Spain;spa;low confidence;non definito;non definito;open;CC-BY-1.0;csv;3_star;37162620;2020-04-14
10.5281/zenodo.3749559;COVID-19_WORLD_2020;eng;en;non definito;non definito;open;CC-BY-1.0;csv;3_star;23215885;2020-04-14
10.5281/zenodo.3749652;Covid-19 - impact on evolution of energy demand;eng;low confidence;non definito;non definito;open;CC-BY-4.0;csv;3_star;695766;2020-04-15
10.5281/zenodo.3749747;Measures to mitigate the spread of COVID-19 in Switzerland;eng;en;non definito;non definito;open;CC-BY-4.0;csv;3_star;5567112;2020-04-14
10.5281/zenodo.3749823;Covid-19 cases per country snapshot;eng;low confidence;non definito;non definito;open;ODC-By-1.0;csv;3_star;715800;2020-04-14
10.5281/zenodo.3749902;Transcriptomic response of human cells to SARS-CoV-2, RSV and H1N1 (STAR + StringTie);eng;en;ambito genomico;ambito genomico   ;open;CC0-1.0;csv,txt;3_star;840085551;2020-05-18
10.5281/zenodo.3751193;Coronavirus tweets TEST;;en;social network;social network   ;open;CC-BY-4.0;zip;non classificabile;44984707350;2020-04-15
10.5281/zenodo.3751561;Data and Code to support COVID-19 - exploring the implications of long-term condition type and extent of multimorbidity on years of life lost: a modelling study;;en;non definito;non definito;open;CC-BY-4.0;,csv,r,rds,rmd,txt;3_star;786864327;2020-04-15
10.5281/zenodo.3751583;SIRAH-CoV2  initiative: Apo ADP ribose phosphatase of NSP3 from SARS CoV-2 (PDB id: 6W02);eng;low confidence;non definito;non definito;open;CC-BY-4.0;tar;3_star;31858227200;2021-01-13
10.5281/zenodo.3751797;COVID-19, evolución y repercusión.;;es;non definito;non definito;open;CC-BY-4.0;csv;3_star;22301248;2020-04-15
10.5281/zenodo.3752540;Raw diffraction data (CBF) for a structure of SARS-CoV-2 Main Protease bound to 2-Methyl-1-tetralone;;en;non definito;non definito;open;CC-BY-4.0;cbf,jpg,log,txt;2_star;18173748166;2020-05-13
10.5281/zenodo.3753552;Stable psychological traits predict perceived stress related to the COVID-19 outbreak;eng;en;non definito;non definito;open;CC-BY-4.0;arff,pdf,xlsx;2_star;315229998;2020-04-21
10.5281/zenodo.3754178;Bibliographic data and analysis of COVID-19 research outputs from Imperial College London 16.01.2020-02.04.2020;eng;en;altro;ambito epidemiologico   ;open;CC-BY-4.0;xlsx;2_star;5979476;2020-07-22
10.5281/zenodo.3754643;SIRAH-CoV2  initiative: NSP9 RNA binding protein (PDBid:6W4B);eng;low confidence;non definito;non definito;open;CC-BY-4.0;tar;3_star;45101649920;2021-01-13
10.5281/zenodo.3754719;Dysregulation in mTOR/HIF-1 signaling identified by proteo-transcriptomics of SARS- CoV-2 infected cells - Proteomic data obtained with Huh-7 cells;eng;en;ambito genomico;ambito genomico   ;open;CC-BY-4.0;raw;non classificabile;17004623954333;2020-04-29
10.5281/zenodo.3755378;DATASET THE COVID19 ECONOMIC PROSPECTS 2020 & 2021 of IFM;eng;low confidence;non definito;non definito;open;CC-BY-4.0;xlsx;2_star;623483517;2020-04-21
10.5281/zenodo.3755835;SIRAH-CoV2  initiative: Nucleocapsid protein N-terminal RNA binding domain (PDB id:6M3M);eng;low confidence;non definito;non definito;open;CC-BY-4.0;tar;3_star;54933207040;2021-01-13
10.5281/zenodo.3756937;Selectomic and Evolvability Analyses of the Highly Pathogenic Betacoronaviruses SARS-CoV-2, SARS-CoV, and MERS-CoV;;en;non definito;non definito;open;CC-BY-4.0;xlsx;2_star;15598182;2020-04-20
10.5281/zenodo.3757476;COVID-19 CT Lung and Infection Segmentation Dataset;;low confidence;non definito;non definito;open;CC-BY-4.0;zip;non classificabile;15667922224753;2020-04-20
10.5281/zenodo.3757554;Coronavirus COVID-19 (2019-nCoV) Data Repository for Africa;;en;non definito;non definito;open;CC-BY-4.0;csv,md;3_star;52508235;2020-04-20
10.5281/zenodo.3758730;SARS-CoV-2 vs. Homo sapiens BLASTP protein sequence analysis results;;low confidence;non definito;non definito;open;CC-BY-4.0;txt;1_star;10706514;2020-04-21
10.5281/zenodo.3763421;Lung ultrasonography features and risk stratification in 80 patients with COVID-19: a prospective observational cohort study;eng;en;ambito clinico;ambito clinico   ;open;CC-BY-4.0;csv;3_star;6084187;2020-04-28
10.5281/zenodo.3765375;Linked COVID-19 Data: Ontology;;low confidence;non definito;non definito;open;CC-BY-4.0;owl;trascurato;5198930;2020-04-24
10.5281/zenodo.3766270;SIRAH-CoV2  initiative:  Papain-like Protease   (PDB id:6W9C);eng;low confidence;non definito;non definito;open;CC-BY-4.0;tar;3_star;301144401920;2021-01-13
10.5281/zenodo.3767056;Network-based Drug Repurposing for Human Coronavirus;eng;en;ambito genomico;ambito genomico   ;open;CC-BY-4.0;zip;non classificabile;630849562;2020-04-27
10.5281/zenodo.3775672;Data and code for changes in contact patterns shape the dynamics of the novel coronavirus disease 2019 outbreak in China;;en;altro;ambito genomico   ;open;CC-BY-4.0;zip;non classificabile;7682802;2020-04-30
10.5281/zenodo.3779002;SIRAH-CoV2  initiative: S1 Receptor Binding Domain in complex with human antibody CR3022 (PDBid: 6W41);eng;low confidence;non definito;non definito;open;CC-BY-4.0;tar;3_star;89703168000;2021-01-13
10.5281/zenodo.3779045;A SARS-CoV-2-Human Protein-Protein Interaction Map Reveals Drug Targets and Potential Drug-Repurposing;eng;en;ambito genomico;ambito genomico   ;open;CC-BY-4.0;pdf,xlsx,zip;2_star;195599380;2020-05-16
10.5281/zenodo.3779057;SIRAH-CoV2  initiative: NSP16 - NSP10 Complex (PDB id:6W4H);eng;low confidence;non definito;non definito;open;CC-BY-4.0;tar;3_star;36557864960;2021-01-13
10.5281/zenodo.3779306;CanESM5 data for CCCma COVID-19 climate scenarios;eng;low confidence;non definito;non definito;open;CC-BY-4.0;tar;3_star;53913600;2020-06-06
10.5281/zenodo.3780132;COG-UK Viral Genome Sequences;;en;ambito genomico;ambito genomico   ;open;CC-BY-4.0;fasta,newick,txt;3_star;5465425501;2020-05-04
10.5281/zenodo.3780511;Genome-wide structure and function modeling of SARS-COV-2;eng;low confidence;non definito;non definito;open;CC-BY-4.0;bz2,fasta,zip;3_star;29600043;2020-05-03
10.5281/zenodo.3783510;The transcriptomic profiling of COVID-19 compared to  SARS, MERS, Ebola, and H1N1;eng;en;ambito clinico;ambito epidemiologico   ;open;CC-BY-4.0;jpg,png,xls,xlsx;2_star;517843293;2020-05-04
10.5281/zenodo.3783636;Not only pulmonary rehabilitation for critically ill patients with COVID-19;eng;en;non definito;non definito;open;CC-BY-4.0;csv;3_star;90449;2020-05-04
10.5281/zenodo.3788733;Why has the number of COVID-19 confirmed cases in Africa been insignificant compared to other regions? A descriptive analysis;;en;non definito;non definito;open;CC-BY-4.0;xlsx;2_star;895240;2020-05-13
10.5281/zenodo.3799740;Epidemiology, risk factors and clinical course of SARS-CoV-2 infected patients in a Swiss university hospital: an observational retrospective study;;en;ambito epidemiologico;ambito epidemiologico   ;open;CC-BY-4.0;csv;3_star;493309299;2020-05-13
10.5281/zenodo.3803620;SIRAH-CoV2  initiative:  nsp7-nsp8 complex   (PDB id:6YHU);eng;low confidence;non definito;non definito;open;CC-BY-4.0;tar;3_star;21066854400;2021-01-13
10.5281/zenodo.3807765;All-atom Molecular Dynamics Simulations of SARS-CoV-2 Spike Receptor-binding Domain bound with ACE2;eng;en;non definito;non definito;open;CC-BY-4.0;pdb;3_star;110755340640;2020-05-13
10.5281/zenodo.3813567;COVID-19 Open Research Dataset (CORD-19);eng;low confidence;non definito;non definito;open;other-open;csv,gz,pdf,readme,txt;3_star;74921013866;2020-05-13
10.5281/zenodo.3814373;SIRAH-CoV2 initiative: ORF7A enconded accessory protein  (PDB id:6W37);eng;low confidence;non definito;non definito;open;CC-BY-4.0;tar;3_star;11627776000;2021-01-13
10.5281/zenodo.3816667;Detecting East Asian Prejudice on Social Media;eng;en;non definito;non definito;open;CC-BY-4.0;csv,pdf,tsv,zip;3_star;142209334194;2020-05-13
10.5281/zenodo.3817447;All atom simulations snapshots and contact maps analysis scripts for SARS-CoV-2002 and SARS-CoV-2 spike proteins with and without ACE2 enzyme;eng;en;non definito;non definito;open;CC-BY-4.0;gz,xz;non classificabile;660820836;2020-05-13
10.5281/zenodo.3818306;3DNIV/3DNIV: A Novel Dual Non-Invasive Ventilator Continuous Positive Airway Pressure Non-Aerosolization Circuit for Emergency Use in the COVID-19 Pandemic;eng;en;non definito;non definito;open;other-open;zip;non classificabile;229928944;2020-05-13
10.5281/zenodo.3819284;Dataset and images for Instantaneous R calculation for COVID-19 epidemic in Brazil;;en;non definito;non definito;open;CC-BY-4.0;csv,png,xlsx;3_star;4349934;2020-05-13
10.5281/zenodo.3819297;Haruspex Analysis for SARS-CoV rna_polymerase pdb entry 6nus emdb 0521;;low confidence;non definito;non definito;open;CC-BY-NC-4.0;;trascurato;536879104;2020-05-26
10.5281/zenodo.3820050;100 Bestselller books during COVID-19 in Spain;eng;low confidence;non definito;non definito;open;CC-BY-4.0;csv;3_star;5241934;2020-05-13
10.5281/zenodo.3820092;Haruspex Analysis for SARS-CoV-2 rna_polymerase-nsp7-nsp8 pdb entry 7btf emdb 30178;;low confidence;non definito;non definito;open;CC-BY-4.0;mrc;3_star;1728016384;2020-05-27
10.5281/zenodo.3820094;Haruspex Analysis for SARS-CoV-2 rna_polymerase-nsp7-nsp8 pdb entry 7bv2 emdb 30210;;low confidence;non definito;non definito;open;CC-BY-4.0;;trascurato;537938944;2020-05-28
10.5281/zenodo.3820096;Haruspex Analysis for SARS-CoV-2 rna_polymerase-nsp7-nsp8 pdb entry 6m71 emdb 30127;;low confidence;non definito;non definito;open;CC-BY-4.0;mrc;3_star;1944018432;2020-05-28
10.5281/zenodo.3820098;Haruspex Analysis for SARS-CoV-2 rna_polymerase-nsp7-nsp8 pdb entry 7bv1 emdb 30209;;low confidence;non definito;non definito;open;CC-BY-4.0;;trascurato;453001216;2020-05-28
10.5281/zenodo.3820101;Haruspex Analysis for SARS-CoV rna_polymerase-nsp7-nsp8 pdb entry 6nur emdb 0520;;low confidence;non definito;non definito;open;CC-BY-4.0;;trascurato;872428544;2020-05-28
10.5281/zenodo.3820103;Haruspex Analysis for SARS-CoV-2 surface_glycoprotein pdb entry 6vsb emdb 21375;;low confidence;non definito;non definito;open;CC-BY-4.0;mrc;3_star;3869847552;2020-05-28
10.5281/zenodo.3820105;Haruspex Analysis for SARS-CoV-2 surface_glycoprotein pdb entry 6vyb emdb 21457;;low confidence;non definito;non definito;open;CC-BY-4.0;mrc;3_star;3584014336;2020-05-28
10.5281/zenodo.3820107;Haruspex Analysis for SARS-CoV-2 surface_glycoprotein pdb entry 6vxx emdb 21452;;low confidence;non definito;non definito;open;CC-BY-4.0;mrc;3_star;4352017408;2020-05-28
10.5281/zenodo.3820109;Haruspex Analysis for SARS-CoV-2 surface_glycoprotein pdb entry 6vsj emdb 21377;;low confidence;non definito;non definito;open;CC-BY-4.0;mrc;3_star;1703949312;2020-05-28
10.5281/zenodo.3820111;Haruspex Analysis for SARS-CoV-2 surface_glycoprotein pdb entry 6m17 emdb 30039;;low confidence;non definito;non definito;open;CC-BY-4.0;;trascurato;859972608;2020-05-28
10.5281/zenodo.3820115;Haruspex Analysis for SARS-CoV surface_glycoprotein pdb entry 5x5b emdb 6705;;low confidence;non definito;non definito;open;CC-BY-4.0;;trascurato;2240071680;2020-05-28
10.5281/zenodo.3820117;Haruspex Analysis for SARS-CoV surface_glycoprotein pdb entry 6acd emdb 9589;;low confidence;non definito;non definito;open;CC-BY-4.0;;trascurato;1624392704;2020-05-26
10.5281/zenodo.3820121;Haruspex Analysis for SARS-CoV surface_glycoprotein pdb entry 6crv emdb 7573;;low confidence;non definito;non definito;open;CC-BY-4.0;mrc;3_star;1310730240;2020-05-28
10.5281/zenodo.3820123;Haruspex Analysis for SARS-CoV surface_glycoprotein pdb entry 6cs0 emdb 7578;;low confidence;non definito;non definito;open;CC-BY-4.0;mrc;3_star;1179657216;2020-05-28
10.5281/zenodo.3820125;Haruspex Analysis for SARS-CoV surface_glycoprotein pdb entry 5xlr emdb 6732;;low confidence;non definito;non definito;open;CC-BY-4.0;;trascurato;1146630144;2020-05-28
10.5281/zenodo.3820127;Haruspex Analysis for SARS-CoV surface_glycoprotein pdb entry 6acj emdb 9593;;low confidence;non definito;non definito;open;CC-BY-4.0;;trascurato;573315072;2020-05-28
10.5281/zenodo.3820129;Haruspex Analysis for SARS-CoV surface_glycoprotein pdb entry 6nb6 emdb 0403;;low confidence;non definito;non definito;open;CC-BY-4.0;mrc;3_star;2038440960;2020-05-28
10.5281/zenodo.3820131;Haruspex Analysis for SARS-CoV surface_glycoprotein pdb entry 6acg emdb 9591;;low confidence;non definito;non definito;open;CC-BY-4.0;;trascurato;1242182656;2020-05-28
10.5281/zenodo.3820133;Haruspex Analysis for SARS-CoV surface_glycoprotein pdb entry 6ack emdb 9594;;low confidence;non definito;non definito;open;CC-BY-4.0;;trascurato;1051077632;2020-05-28
10.5281/zenodo.3820135;Haruspex Analysis for SARS-CoV surface_glycoprotein pdb entry 6cs2 emdb 7582;;low confidence;non definito;non definito;open;CC-BY-4.0;mrc;3_star;1306375168;2020-05-28
10.5281/zenodo.3820137;Haruspex Analysis for SARS-CoV surface_glycoprotein pdb entry 5x58 emdb 6703;;low confidence;non definito;non definito;open;CC-BY-4.0;;trascurato;288009216;2020-05-28
10.5281/zenodo.3820139;Haruspex Analysis for SARS-CoV surface_glycoprotein pdb entry 6nb7 emdb 0404;;low confidence;non definito;non definito;open;CC-BY-4.0;mrc;3_star;1296012288;2020-05-28
10.5281/zenodo.3820141;Haruspex Analysis for SARS-CoV surface_glycoprotein pdb entry 6cs1 emdb 7579;;low confidence;non definito;non definito;open;CC-BY-4.0;mrc;3_star;1703949312;2020-05-28
10.5281/zenodo.3820143;Haruspex Analysis for SARS-CoV surface_glycoprotein pdb entry 6acc emdb 9588;;low confidence;non definito;non definito;open;CC-BY-4.0;;trascurato;1242182656;2020-05-28
10.5281/zenodo.3820145;Haruspex Analysis for SARS-CoV surface_glycoprotein pdb entry 5wrg emdb 6679;;low confidence;non definito;non definito;open;CC-BY-4.0;;trascurato;859972608;2020-05-28
10.5281/zenodo.3820147;Haruspex Analysis for SARS-CoV surface_glycoprotein pdb entry 6crw emdb 7574;;low confidence;non definito;non definito;open;CC-BY-4.0;mrc;3_star;1179657216;2020-05-28
10.5281/zenodo.3820187;Haruspex Analysis for SARS-CoV surface_glycoprotein pdb entry 6acj emdb 9593;;low confidence;non definito;non definito;open;CC-BY-4.0;;trascurato;286657536;2020-05-28
10.5281/zenodo.3820189;Haruspex Analysis for SARS-CoV surface_glycoprotein pdb entry 6acg emdb 9591;;low confidence;non definito;non definito;open;CC-BY-4.0;;trascurato;668867584;2020-05-28
10.5281/zenodo.3820191;Haruspex Analysis for SARS-CoV surface_glycoprotein pdb entry 6ack emdb 9594;;low confidence;non definito;non definito;open;CC-BY-4.0;;trascurato;668867584;2020-05-26
10.5281/zenodo.3820193;Haruspex Analysis for SARS-CoV surface_glycoprotein pdb entry 6cs2 emdb 7582;;low confidence;non definito;non definito;open;CC-BY-4.0;mrc;3_star;1119750144;2020-05-28
10.5281/zenodo.3820195;Haruspex Analysis for SARS-CoV-2 surface_glycoprotein pdb entry 6m17 emdb 30039;;low confidence;non definito;non definito;open;CC-BY-4.0;;trascurato;1051077632;2020-05-25
10.5281/zenodo.3820673;SIRAH-CoV2  initiative: co-factor complex of NSP7 and the C-terminal domain of NSP8 from SARS CoV-2 (PDBid:6WIQ);eng;low confidence;non definito;non definito;open;CC-BY-4.0;tar;3_star;45942937600;2021-01-13
10.5281/zenodo.3822299;All-atom 500-nano seconds Molecular Dynamics Simulations of SARS-CoV-2 Spike Receptor-binding Domain bound with ACE2;;en;non definito;non definito;open;CC-BY-4.0;pdb;3_star;24746871725;2020-05-13
10.5281/zenodo.3823277;Prediction of repurposed drugs for treating lung injury in COVID-19;;en;non definito;non definito;open;CC-BY-4.0;csv;3_star;140490810;2020-05-13
10.5281/zenodo.3824950;Digital Narratives of Covid-19: a Twitter Dataset;spa;low confidence;non definito;non definito;open;CC-BY-4.0;zip;non classificabile;2415147075;2020-06-24
10.5281/zenodo.3825310;TOP-100 DOCKING POSES OF FDA APPROVED AND DRUGS IN CLINICAL INVESTIGATION AT SARS-CoV2 SPIKE/ACE2 INTERFACE;;en;non definito;non definito;open;CC-BY-4.0;zip;non classificabile;431739198;2020-05-13
10.5281/zenodo.3825509;TOP-100 DOCKING POSES OF FDA APPROVED DRUGS AND DRUGS IN CLINICAL INVESTIGATION AT SARS-CoV2 MAIN PROTEASE;;en;ambito genomico;ambito genomico   ;open;CC-BY-4.0;zip;non classificabile;266374019;2020-05-13
10.5281/zenodo.3827449;CORD-19 Named Entities Knowledge Graph (CORD19-NEKG);eng;low confidence;non definito;non definito;open;other-open;tar;3_star;154271488000;2020-05-15
10.5281/zenodo.3830413;Coronavirus Open Citations Dataset;;en;non definito;non definito;open;CC0-1.0;zip;non classificabile;225505344;2020-05-16
10.5281/zenodo.3832484;Genomic determinants of pathogenicity in SARS-CoV-2 and other human coronaviruses;;low confidence;non definito;non definito;open;CC-BY-4.0;txt;1_star;51756134783;2020-05-19
10.5281/zenodo.3833763;Dynamics of SARS-CoV-2 spike protein in open and closed states and identification of key structural perturbations upon mutations;;en;ambito genomico;ambito genomico   ;open;CC-BY-4.0;pdb;3_star;2816688589;2020-05-20
10.5281/zenodo.3833846;The trend of morbidity and mortality of Coronavirus disease 2019 under the first-level public health emergency response in China;;en;ambito epidemiologico;ambito clinico   ;open;CC-BY-4.0;xlsx;2_star;3108915;2020-05-20
10.5281/zenodo.3834207;Datasets for How is the Pandemic Affecting AGU Journal Article Submissions?;eng;en;non definito;non definito;open;CC-BY-4.0;csv,txt;3_star;352552;2020-05-20
10.5281/zenodo.3836195;dataset to accompany Managing COVID-19 spread with voluntary public-health measures:  Sweden as a case study for pandemic control;;en;ambito informatico;ambito epidemiologico   ;open;CC-BY-NC-4.0;mat;trascurato;6939908;2020-06-18
10.5281/zenodo.3839065;COVIDmodeling/covid19_data;eng;low confidence;non definito;non definito;open;MIT;zip;non classificabile;1281092325;2020-05-23
10.5281/zenodo.3840465;Variant analysis of SARS-CoV-2 genomes;;low confidence;non definito;non definito;open;CC-BY-4.0;tsv;3_star;1643757018;2020-05-26
10.5281/zenodo.3840625;Molecular docking COVID-19;eng;low confidence;non definito;non definito;open;CC-BY-4.0;zip;non classificabile;201598128;2020-05-26
10.5281/zenodo.3855067;COVID-19 impact on the concentration and composition of submicron particulate matter in a typical city of Northwest China;;en;non definito;non definito;open;CC-BY-4.0;pxp,xlsx;2_star;170361257;2020-05-30
10.5281/zenodo.3860013;Effectiveness of prone positioning in non-intubated ICU patients with moderate to severe ARDS;;en;non definito;non definito;open;CC-BY-4.0;zip;non classificabile;14105575;2020-05-28
10.5281/zenodo.3862076;Data and code for the analysis in Assessing the impact of non-pharmaceutical interventions on SARS-CoV-2 transmission in Switzerland;eng;low confidence;non definito;non definito;open;CC-BY-4.0;zip;non classificabile;22666625991;2020-06-01
10.5281/zenodo.3865424;Analysis of the different approaches adopted in the Italian regions to care for patients affected by COVID-19;eng;en;non definito;non definito;open;CC-BY-4.0;xlsx;2_star;7576730;2020-06-02
10.5281/zenodo.3865479;SIRAH-CoV2 initiative: RNA-dependent RNA polymerase in complex with cofactors Nsp7 and Nsp8 (PDB id:7BTF);eng;low confidence;non definito;non definito;open;CC-BY-4.0;tar;3_star;106052823040;2021-01-13
10.5281/zenodo.3865719;Investigating evolution at the catalytic site of the main SARS-CoV-2 protease using over 15,000 genomes;;en;ambito genomico;ambito genomico   ;open;CC-BY-4.0;docx;2_star;555380;2020-06-19
