doi;title;language;language_detected;ambito_reale;ambito_detected;access_right;license;formati;star;volume;updated
10.5281/zenodo.4016325;Replication package for «Business disruptions from social distancing»;;low confidence;non definito;non definito;open;other-open;md,pdf,zip;1_star;9782740833;2020-09-06
10.5281/zenodo.4016459;Contaminación atmosférica durante el COVID-19;;es;non definito;non definito;open;CC-BY-4.0;xlsx;2_star;2485732;2020-09-08
10.5281/zenodo.4016941;Datasets to Piecewise quadratic growth during the 2019 novel coronavirus epidemic;;en;non definito;non definito;open;CC-BY-4.0;pdf,zip;1_star;14769184;2020-09-08
10.5281/zenodo.4019350;SIRAH-CoV2  initiative:  S2 Spike core fragment in postfusion state   (PDB id:6M1V);eng;low confidence;non definito;non definito;open;CC-BY-4.0;tar;3_star;170263347200;2021-01-13
10.5281/zenodo.4019808;Embeddings of KG-COVID-19 knowledge graph (Aug 12 build), 80/20 training/test split, produced using node2vec, skipgram model, p=q=1, walk length = 100, num walks = 20;;en;ambito informatico;ambito informatico   ;open;CC-BY-4.0;h5,npy;trascurato;5114062456;2020-09-09
10.5281/zenodo.4021611;Genomic Evidence for a Case of Reinfection with SARS-CoV-2;;low confidence;non definito;non definito;open;CC-BY-4.0;bam,cpw,fasta,pdf,sh,vcf;3_star;3198508302;2020-09-10
10.5281/zenodo.4023275;AraHealth: A Dataset for Arabic Health-Related Advice Directed to the General Public on Twitter During the Early Spread of COVID-19 [Dataset];;en;social network;social network   ;open;CC-BY-4.0;csv;3_star;3047535200;2021-01-13
10.5281/zenodo.4024141;The CoVidAffect dataset of mood variations following the COVID-19 outbreak in Spain;;low confidence;non definito;non definito;open;CC-BY-4.0;zip;non classificabile;228560334;2020-09-11
10.5281/zenodo.4024154;CMU-MisCov19: A Novel Twitter Dataset for Characterizing COVID-19 Misinformation;;en;social network;social network   ;open;CC-BY-4.0;pdf,zip;1_star;92362427;2020-12-31
10.5281/zenodo.4024177;COVID-19 Tweets : A dataset contaning more than 600k tweets on the novel CoronaVirus;eng;en;social network;social network   ;open;CC-BY-4.0;csv;3_star;22330106255;2021-01-23
10.5281/zenodo.4025491;Aerocargo Trafic Argentina - from 2014 to 2019 (no covid-19 data included) Critical Infrastructure Risk Research Program;;es;non definito;non definito;open;CC-BY-4.0;zip;non classificabile;970597992;2020-09-12
10.5281/zenodo.4026121;STROBE checklist for a set of scientific works about COVID-19;;low confidence;non definito;non definito;open;CC-BY-4.0;csv;3_star;140811;2020-09-13
10.5281/zenodo.4027947;Dataset for English Health-Related Advice Directed to the General Public on Twitter During the Early Spread of COVID-19 [Dataset];;en;social network;social network   ;open;CC-BY-4.0;csv;3_star;7484763682;2021-01-13
10.5281/zenodo.4029296;Data for Learning the language of viral evolution and escape;;low confidence;non definito;non definito;open;CC-BY-4.0;gz;non classificabile;6440495535;2020-09-15
10.5281/zenodo.4031204;Bulk and single-cell gene expression profiling of SARS-CoV-2 infected human cell lines identifies molecular targets for therapeutic intervention;;low confidence;non definito;non definito;open;CC-BY-4.0;csv,rds;3_star;20032084614;2020-09-30
10.5281/zenodo.4031401;MLP link prediction models in H5 format;;en;non definito;non definito;open;CC-BY-4.0;csv,h5;3_star;21894315;2020-09-17
10.5281/zenodo.4032708;Geostatistical Analysis of SARS-CoV-2 Positive Cases in the United States;eng;en;non definito;non definito;open;CC-BY-4.0;docx,zip;2_star;24051532572;2020-09-17
10.5281/zenodo.4033491;Acute Respiratory Distress Syndrome-Database of Genes (ARDS-DB);;en;non definito;non definito;open;CC-BY-4.0;db,sql;trascurato;13145984;2020-09-17
10.5281/zenodo.4034277;A comparative dataset on public perceptions of multiple risks during the COVID-19 pandemic in Italy and Sweden;eng;en;non definito;non definito;open;CC-BY-4.0;csv,docx,xlsx;3_star;51270583;2020-12-10
10.5281/zenodo.4035990;Data to: Aerosol emission of child voices during speaking, singing and shouting;eng;en;non definito;non definito;open;CC-BY-4.0;csv,pdf,rmd;3_star;31787174;2020-09-22
10.5281/zenodo.4040492;Base de Datos Documentos Publicados sobre COVID-19 en Argentina (07/09/2020);;low confidence;non definito;non definito;open;CC-BY-4.0;clu,doc,net,txt,vec,vel,xlsx;2_star;4779558;2020-09-22
10.5281/zenodo.4044378;SIRAH-CoV2  initiative: Membrane embedded SARS-CoV-2 ORF3a  (PDB id:6XDC);;low confidence;non definito;non definito;open;CC-BY-4.0;tar;3_star;465698611200;2021-01-13
10.5281/zenodo.4045875;Raw data for arXiv:2009.09702;;low confidence;non definito;non definito;open;CC-BY-4.0;zip;non classificabile;629120;2020-09-23
10.5281/zenodo.4046538;VTR case studies datasets: myoglobin against hemoglobin, RBDs of SARS-CoV-1 vs. SARS-CoV-2, and glucose-tolerant vs. non-tolerant β-glucosidases;eng;low confidence;non definito;non definito;open;CC-BY-4.0;xlsx,zip;2_star;2161455;2020-09-24
10.5281/zenodo.4047144;KG-COVID-19 graph containing all current sources EXCEPT ChEMBL antivirals;;low confidence;non definito;non definito;open;CC-BY-4.0;gz,yaml;non classificabile;7852350342;2020-09-24
10.5281/zenodo.4047648;INTRODUCTION OF COVID-NEWS-US-NNK AND COVID-NEWS-BD-NNK DATASET;eng;en;ambito informatico;ambito informatico   ;open;CC-BY-4.0;csv,pdf;3_star;70793288;2020-09-24
10.5281/zenodo.4047811;Sudanese Jibbah in UK Institutions;;en;non definito;non definito;open;CC-BY-4.0;csv,docx;3_star;5750561;2020-09-24
10.5281/zenodo.4048460;Dataset covidgilance signals;;en;ambito informatico;social network   ;open;CC-BY-4.0;,csv,md,pl,py,tsv;3_star;45781488;2020-09-25
10.5281/zenodo.4049744;NOx Emission Changes over China during the COVID-19 Epidemic Inferred from Surface NO2 Observations;;en;non definito;non definito;open;CC-BY-4.0;csv,docx,gz;3_star;7480236574;2020-09-26
10.5281/zenodo.4050451;covid co-infections;;low confidence;non definito;non definito;open;CC-BY-4.0;txt;1_star;140890686;2020-10-14
10.5281/zenodo.4050576;Molecular Docking ZINC DB;eng;low confidence;non definito;non definito;open;CC-BY-4.0;zip;non classificabile;41375664;2020-09-26
10.5281/zenodo.4055943;Synthetic COVID-19 Case Reporting Data Generated from an Agent-Based Simulation Model;eng;en;ambito informatico;ambito informatico   ;open;CC-BY-4.0;zip;non classificabile;109085704;2020-10-02
10.5281/zenodo.4058116;Effects of COVID-19 lockdown on heart rate variability;eng;en;non definito;non definito;open;CC-BY-4.0;zip;non classificabile;366041328;2020-09-29
10.5281/zenodo.4059188;Enhanced PM2.5 Decreases and O3 Increases in China during COVID-19 Lockdown by Aerosol-Radiation Feedback;;en;non definito;non definito;open;CC-BY-4.0;nc;3_star;50476844;2020-10-25
10.5281/zenodo.4059716;LEOSS Public Use File;eng;low confidence;non definito;non definito;open;CC-BY-4.0;csv;3_star;10161393;2020-10-09
10.5281/zenodo.4060166;The Psychological Burden of the COVID-19 Pandemic and Its Associated Factors among the Frontline Doctors of Bangladesh: A Cross-sectional Study-Extended Data;eng;en;non definito;non definito;open;CC-BY-1.0;pdf;1_star;39492003;2020-10-01
10.5281/zenodo.4060340;Datasets for Tweets from Anonymous Physicians about COVID-19 in the U.S.;eng;en;social network;social network   ;open;CC-BY-4.0;csv;3_star;2021645;2020-10-01
10.5281/zenodo.4061192;Molecular Dynamics simulations of SARS-CoV and SARS-CoV-2 main proteases in monomeric/dimeric and apo/holo states.;;en;ambito genomico;ambito genomico   ;open;CC-BY-4.0;pdb,xtc;3_star;0;2021-06-01
10.5281/zenodo.4065547;Longitudinal high-throughput TCR repertoire profiling reveals the dynamics of T cell memory formation after mild COVID-19 infection;;low confidence;non definito;non definito;open;CC-BY-4.0;zip;non classificabile;49425985149;2020-10-05
10.5281/zenodo.4066513;Monthly CO2 emissions projections from 2015-2025: modified SSP2-4.5 to account for COVID-19 impacts on sector activity;eng;en;non definito;non definito;open;CC-BY-4.0;5nc,nc;3_star;32744524758;2020-10-08
10.5281/zenodo.4068554;Impact of coronavirus disease 2019 (COVID-19) outbreak on radiology research: an Italian survey;ita;en;non definito;non definito;open;CC-BY-4.0;xlsx;2_star;573364;2020-10-08
10.5281/zenodo.4068958;CETAF-DiSSCo/COVID19-TAF biodiversity-related knowledge hub working group: indexed biotic interactions and review summary;eng;low confidence;non definito;non definito;open;CC-BY-4.0;,gz,jar,log,sh,tsv,zip;3_star;4919934353;2020-10-08
10.5281/zenodo.4071421;An in silico docking simulation of SARS Coronavirus2 and Ivermectin;;low confidence;non definito;non definito;open;CC-BY-4.0;pdf,zip;1_star;12191718;2020-10-08
10.5281/zenodo.4071499;Data from: The impact of human mobility networks on the global spread of COVID-19;eng;low confidence;non definito;non definito;open;CC-BY-4.0;csv,graphmlz,pdf,xlsx;3_star;16664651;2021-03-23
10.5281/zenodo.4072484;DAS data of Penn State FORESEE array during the COVID-19 measures;;en;non definito;non definito;open;CC-BY-4.0;txt,zip;1_star;116667748601;2021-03-12
10.5281/zenodo.4074307;Emission primarily drives nationwide air quality changes during and after the COVID-19 lockdown in China;;en;non definito;non definito;open;CC-BY-NC-4.0;nc,xlsx,zip;3_star;45898812070;2020-10-09
10.5281/zenodo.4081140;Social contact data before and during COVID-19 in China;eng;en;non definito;non definito;open;CC-BY-4.0;csv,xls;3_star;70090638;2020-10-12
10.5281/zenodo.4081988;covid co-infections 2;;low confidence;non definito;non definito;open;CC-BY-4.0;tabular,txt;3_star;335644203;2020-10-15
10.5281/zenodo.4085730;Recombinant human ACE2 protein production and purification;;low confidence;non definito;non definito;open;CC-BY-4.0;docx;2_star;4706925;2020-10-15
10.5281/zenodo.4091746;Production and purification of receptor-binding domain (RBD) of the Spike protein from a transiently transfected mammalian cell;;en;non definito;non definito;open;CC-BY-4.0;docx;2_star;2068920;2020-11-05
10.5281/zenodo.4096183;Data Literacies & Practices in Higher Education: Educators' Perspectives;eng;en;non definito;non definito;open;CC-BY-4.0;xlsx;2_star;1548525;2020-10-18
10.5281/zenodo.4097261;Pandemia de COVID-19: Um Banco de Dados de Respostas Políticas Relacionadas ao Setor Financeiro;;pt;non definito;non definito;open;CC-BY-4.0;xlsx;2_star;8838947;2020-11-17
10.5281/zenodo.4097289;Despesas detalhadas - COVID-19  - Portal da Transparência de Pernambuco;;pt;non definito;non definito;open;CC-BY-4.0;csv,json;3_star;162695250;2020-11-17
10.5281/zenodo.4104390;The Daily Life of Software Engineers during the COVID-19 Pandemic -- Replication Package;;en;non definito;non definito;open;CC-BY-4.0;csv,pdf,r;3_star;39683949;2020-10-19
10.5281/zenodo.4108539;Pandemic-related Attitudes, Stressors and Work Outcomes among Medical Assistants during the SARS-CoV-2 (Coronavirus) Pandemic in Germany:  a cross-sectional Study;eng;low confidence;non definito;non definito;open;CC-BY-4.0;sav;trascurato;1166557;2021-01-06
10.5281/zenodo.4108608;Attitudes, Stressors and Work Outcomes related to the COVID-19 Pandemic among Dental Assistants in Germany:  A cross-sectional Study;eng;en;ambito psicologico;ambito psicologico   ;open;CC-BY-4.0;sav;trascurato;956180;2021-09-10
10.5281/zenodo.4110337;The psychological burden of the COVID-19 pandemic and its associated factors among the frontline doctors of Bangladesh: A cross-sectional study;eng;en;ambito psicologico;ambito epidemiologico   ;open;CC-BY-1.0;sav;trascurato;966739;2020-10-22
10.5281/zenodo.4110560;The spatial landscape of lung pathology during COVID-19 progression - raw IMC data;eng;en;ambito clinico;ambito clinico   ;open;CC-BY-4.0;mcd;2_star;2001309514627;2021-03-25
10.5281/zenodo.4114615;HEART - Bagnolo in Piano monitoring dataset, Reggio Emilia – Italy;eng;en;non definito;non definito;open;EUPL-1.2;zip;non classificabile;65388076;2020-10-21
10.5281/zenodo.4117601;JRC COVID-19 In Vitro Diagnostic Devices and Test Methods Database;eng;en;ambito informatico;ambito informatico   ;open;CC-BY-4.0;zip;non classificabile;2621753;2020-10-22
10.5281/zenodo.4118419;Is disruption of sleep quality a consequence of severe Covid-19 infection? A case-series examination;;en;ambito clinico;ambito clinico   ;open;CC-BY-4.0;aw5;trascurato;74383360;2020-10-23
10.5281/zenodo.4126350;GECOVID dataset - Genoa, Italy;eng;low confidence;non definito;non definito;open;CC-BY-4.0;xlsx;2_star;8741520;2020-10-26
10.5281/zenodo.4126984;BreakingVane/Defining-resilience-empirically_UCM:  Defining resilience empirically_UCM;;low confidence;non definito;non definito;open;other-open;zip;non classificabile;770413;2020-10-26
10.5281/zenodo.4132124;Dataset of Policy Responses to COVID-19 pandemic in Vietnam;;low confidence;non definito;non definito;open;CC-BY-4.0;rar;non classificabile;3382821;2020-10-26
10.5281/zenodo.4133861;Imperial College London COVID-19 preprints and reports Jan - Aug 20;;low confidence;non definito;non definito;open;CC-BY-4.0;xlsx;2_star;2476551;2020-10-29
10.5281/zenodo.4139443;The spatial landscape of lung pathology during COVID-19 progression - processed IMC data;eng;en;ambito clinico;ambito clinico   ;open;CC-BY-NC-4.0;h5ad,tiff;non classificabile;22914906830;2021-03-25
10.5281/zenodo.4140161;Single-cell immune repertoire sequencing of two convalescent COVID-19 patients;eng;low confidence;non definito;non definito;open;CC-BY-4.0;zip;non classificabile;842288146;2020-11-10
10.5281/zenodo.4140171;Depression and Stress among Bangladeshi Students during COVID-19 Lockdown;eng;en;ambito psicologico;ambito psicologico   ;open;CC-BY-4.0;csv;3_star;27289475;2020-10-29
10.5281/zenodo.4146993;Dataset: COVID-19 implications on maritime trade flows;;en;altro;ambito informatico   ;open;CC-BY-4.0;csv,txt,xlsx;3_star;202586598279;2021-01-11
10.5281/zenodo.4151380;Targeted Intracellular Degradation of SARS-CoV-2 via Computationally-Optimized Peptide Fusions;;en;ambito informatico;ambito clinico   ;open;CC-BY-4.0;csv,fcs,pdb,xls;3_star;24122826;2020-10-29
10.5281/zenodo.4152999;Data set,  combining epidemiological,  genetics, and government stringency data of COVID-19 pandemic.;eng;low confidence;non definito;non definito;open;CC-BY-4.0;xlsx;2_star;40015008;2020-11-04
10.5281/zenodo.4153404;Misinformation of COVID-19 on Twitter;;low confidence;non definito;non definito;open;other-open;zip;non classificabile;7333670;2021-01-21
10.5281/zenodo.4156647;Dataset and Data analysis for Infrared based saliva screening test for COVID-19;eng;en;ambito informatico;ambito epidemiologico   ;open;CC-BY-4.0;ows,pdf,xlsx;2_star;116318546;2021-05-14
10.5281/zenodo.4164777;catalonia_rural_houses_2020;cat;ca;non definito;non definito;open;CC-BY-4.0;csv;3_star;5994846;2020-10-31
10.5281/zenodo.4223292;leonardo-ks/sentimen-pemilu2020: Dataset hasil Klasifikasi Sentimen Pengguna Twitter terhadap Pilkada Serentak 2020 pada Pandemi COVID-19;;low confidence;non definito;non definito;open;other-open;zip;non classificabile;102928;2021-02-03
10.5281/zenodo.4242935;COVID19 - Clinical Trials;cat;en;ambito informatico;ambito informatico   ;open;CC-BY-4.0;csv;3_star;2461096106;2020-11-04
10.5281/zenodo.4245782;COVID-19 lockdown in Beijing;;en;non definito;non definito;open;CC-BY-4.0;xlsx;2_star;1639816;2020-11-06
10.5281/zenodo.4246082;Air quality during COVID-19 in Beijing_data_sharing;;en;non definito;non definito;open;CC-BY-4.0;xlsx;2_star;2256441;2020-11-06
10.5281/zenodo.4247134;Covid-on-the-Web dataset;eng;low confidence;non definito;non definito;open;other-open;tar;3_star;374442209280;2020-11-06
10.5281/zenodo.4250123;SIRAH-CoV2 initiative: SARS-CoV-2 helicase (PDB id:6ZSL);eng;low confidence;non definito;non definito;open;CC-BY-4.0;tar;3_star;114460805120;2021-01-13
10.5281/zenodo.4255246;SUPPLIMENTARY Dataset - A STUDY ON STATISTICAL MODELLING ON RECOVERY INFORMATICS OF COVID19;eng;low confidence;non definito;non definito;open;CC-BY-4.0;pdf;1_star;10491154;2020-11-07
10.5281/zenodo.4255968;Pengaruh pandemi covid-19 di indonesia terhadap perubahan perilaku pembelian barang kebutuhan di e-commerce;ind;low confidence;non definito;non definito;open;CC-BY-4.0;xlsx;2_star;742665;2020-11-07
10.5281/zenodo.4256839;covid19AndWbIndicators;bah;es;non definito;non definito;open;CC-BY-4.0;csv;3_star;463814;2020-11-08
10.5281/zenodo.4256998;Production and purification protocols for Ectodomain of SARS-CoV-2 Spike (S) protein;;low confidence;non definito;non definito;open;CC-BY-4.0;docx;2_star;1687644;2020-11-27
10.5281/zenodo.4259934;Contagios y mortalidad de COVID19 por país;ang;en;ambito epidemiologico;ambito clinico   ;open;CC-BY-4.0;csv;3_star;256824;2020-11-09
10.5281/zenodo.4262196;Report of demographic and employment description of each of the interviewees. Covidless  Approach & Trust Project;eng;en;non definito;non definito;open;CC-BY-4.0;docx;2_star;129626;2020-11-09
10.5281/zenodo.4263399;Shares of stock during COVID 19 in automotive sector;spa;en;non definito;non definito;open;CC-BY-1.0;xlsx;2_star;961632;2020-11-09
10.5281/zenodo.4264162;Evolution of Physical Activity Habits After A Context Change: The Case of COVID-19 Lockdown;;low confidence;non definito;non definito;open;CC-BY-4.0;xlsx;2_star;1001416;2020-11-09
10.5281/zenodo.4266003;Preventive behaviours during the pandemic: the role of collective rituals, emotional synchrony, social norms, and moral obligation;spa;en;ambito psicologico;ambito psicologico   ;open;CC-BY-4.0;sav;trascurato;297300;2020-11-10
10.5281/zenodo.4266529;RCT studies on preventive measures and treatments for COVID-19;eng;en;ambito epidemiologico;ambito epidemiologico   ;open;CC-BY-4.0;xlsx;2_star;37029722;2020-11-12
10.5281/zenodo.4266758;COVID-19 mortality correlation with cloudiness, sunlight, latitude in European countries;;low confidence;non definito;non definito;open;CC-BY-4.0;csv,png,txt;3_star;3868593;2020-11-11
10.5281/zenodo.4267033;COVID-19 Twitter data, keyword stream 2020-01-13 to 2020-06-06;eng;en;social network;social network   ;open;CC-BY-4.0;gz;non classificabile;3815536245;2020-11-11
10.5281/zenodo.4269905;I see how you feel: facial expressions' recognition and distancing in the time of COVID-19;;en;ambito informatico;ambito informatico   ;open;CC-BY-4.0;html,txt,xlsx;2_star;42957873;2020-11-13
10.5281/zenodo.4269922;Imperial College London COVID-19 outputs Jan-Sep 20;;low confidence;non definito;non definito;open;CC-BY-4.0;xlsx;2_star;3184020;2020-11-13
10.5281/zenodo.4271534;Impact of COVID-19 on mental health and wellbeing in Austria: Dataset;;en;ambito psicologico;ambito psicologico   ;open;CC-BY-4.0;docx,pdf,xlsx;2_star;58170249;2021-03-11
10.5281/zenodo.4271922;A process proposal on how to move from data requirements to semantic data in the context of the MDA;eng;en;ambito informatico;ambito informatico   ;open;CC-BY-4.0;owl,rdf,txt,zip;1_star;64393980;2020-11-14
10.5281/zenodo.4271923;Well-being and Productivity of Software Professionals during a Pandemic;eng;en;ambito psicologico;ambito epidemiologico   ;open;CC-BY-4.0;zip;non classificabile;46791972;2020-11-14
10.5281/zenodo.4275484;Mental health consequences of the Covid-19 outbreak in Spain;;en;non definito;non definito;open;CC-BY-4.0;rda,xlsx;2_star;207671593;2020-12-16
10.5281/zenodo.4275703;Electron microscopy of SARS-CoV-2 particles - Dataset 08;eng;en;non definito;non definito;open;CC-BY-4.0;zip;non classificabile;1168041184;2020-11-17
10.5281/zenodo.4275728;Electron microscopy of SARS-CoV-2 particles - Dataset 09;;en;non definito;non definito;open;CC-BY-4.0;zip;non classificabile;1530728656;2020-11-17
10.5281/zenodo.4275735;Electron microscopy of SARS-CoV-2 particles - Dataset 10;eng;en;non definito;non definito;open;CC-BY-4.0;zip;non classificabile;745705968;2020-11-17
10.5281/zenodo.4275742;Electron microscopy of SARS-CoV particles - Dataset 11;eng;en;non definito;non definito;open;CC-BY-4.0;zip;non classificabile;96435013152;2020-11-17
10.5281/zenodo.4275769;Electron microscopy of SARS-CoV-2 particles - Dataset 12;eng;en;non definito;non definito;open;CC-BY-4.0;zip;non classificabile;36902941370;2020-11-17
10.5281/zenodo.4276565;COVID-19-data-sharing-final;;low confidence;non definito;non definito;open;CC-BY-4.0;xlsx;2_star;266086805;2020-11-17
10.5281/zenodo.4276587;Beijing: COVID-19-data-sharing-final;;low confidence;non definito;non definito;open;CC-BY-4.0;xlsx;2_star;237748215;2020-11-17
10.5281/zenodo.4277651;Robust estimates of the true (population) infection rate for COVID-19: a backcasting approach;;en;ambito informatico;ambito informatico   ;open;CC-BY-4.0;zip;non classificabile;703091468;2020-11-19
10.5281/zenodo.4277689;Identification and validation of 174 COVID‑19 vaccine candidate epitopes reveals low performance of common epitope prediction tools;;low confidence;non definito;non definito;open;CC-BY-4.0;csv,xlsx;3_star;384377866;2020-11-18
10.5281/zenodo.4277899;Dataset of the article Citizen science during emergencies: Brazilian initiatives to face the covid-19 pandemic;por;low confidence;non definito;non definito;open;CC-BY-4.0;csv;3_star;43975;2021-04-14
10.5281/zenodo.4277989;SIRAH-CoV2 initiative: RBD triple glycosylated at Asn331, 343, and 481 from PDB structure 6XEY;eng;low confidence;non definito;non definito;open;CC-BY-4.0;tar;3_star;94246369280;2021-01-13
10.5281/zenodo.4278326;Code and data sharing for manuscript titled Transmission heterogeneities, kinetics, and controllability of SARS-CoV-2;;low confidence;non definito;non definito;open;CC-BY-4.0;zip;non classificabile;7434422691;2020-11-18
10.5281/zenodo.4278891;Novel Coronavirus (COVID-19) Cases in The Netherlands;;en;non definito;non definito;open;CC-BY-4.0;pdf,zip;1_star;4483065495;2020-12-14
10.5281/zenodo.4282048;Dataset for Early pandemic molecular diversity of SARS-CoV-2 in children;;low confidence;non definito;non definito;open;CC-BY-4.0;fna,xlsx;2_star;16602680;2020-11-20
10.5281/zenodo.4282522;COVID Fake News Dataset;;en;social network;ambito informatico   ;open;CC-BY-4.0;csv;3_star;2216613240;2020-11-27
10.5281/zenodo.4282766;COVID Emissions Nudged Simulations;eng;low confidence;non definito;non definito;open;CC-BY-4.0;nc;3_star;84360859351;2020-11-21
10.5281/zenodo.4283357;Linked Data representation of COVID-19 data for Italy;eng;en;non definito;non definito;open;CC-BY-4.0;zip;non classificabile;12180574;2021-06-30
10.5281/zenodo.4284782;Ethical Perspectives in AI: A Two-folded Exploratory Study From Literature and Active Development Projects - Supplementary Material;eng;en;ambito informatico;ambito informatico   ;open;CC-BY-4.0;ods;2_star;647037;2020-11-23
10.5281/zenodo.4285789;SequenceBouncer Example Datafiles;eng;en;non definito;non definito;open;CC-BY-4.0;csv,fasta,txt,zip;3_star;7903979165;2020-11-24
10.5281/zenodo.4288356;Snapshots, frequency contact maps analysis, Poisson Boltzmann calculations, and data scripts for characterization of structural and energetic differences between conformations of the SARS-CoV-2 spike protein;eng;low confidence;non definito;non definito;open;CC-BY-4.0;xz;trascurato;127218360;2020-11-24
10.5281/zenodo.4292567;Integrative genomic analyses identify susceptibility genes underlying COVID-19 hospitalization;;low confidence;non definito;non definito;open;CC-BY-4.0;csv,docx,txt;3_star;1118974017;2021-06-11
10.5281/zenodo.4292953;The Spring Festival Effect: the change of NO2 column concentration in China caused by the migration of human activities;;en;non definito;non definito;open;CC-BY-4.0;csv,txt;3_star;58737;2020-11-27
10.5281/zenodo.4293521;AlienRemover: data and materials;;en;non definito;non definito;open;CC-BY-4.0;gz,kmr;non classificabile;0;2020-11-28
10.5281/zenodo.4294034;Blood test dynamics in hospitalized COVID-19 patients: potential utility of D-dimer for pulmonary embolism diagnosis;eng;low confidence;non definito;non definito;open;CC-BY-4.0;sav;trascurato;3029997;2020-11-28
10.5281/zenodo.4295689;Israel Ministry of Health COVID data from November 18th 2020;;en;non definito;non definito;open;CC-BY-4.0;csv;3_star;390780;2020-11-29
10.5281/zenodo.4295829;English Vaccine-related Twitter data (Tweet IDs) 2018-07-01 to 2020-09-30;eng;low confidence;non definito;non definito;open;CC-BY-4.0;gz;non classificabile;9041903;2020-11-29
10.5281/zenodo.4296031;Anthropometric data set;lav;en;altro;ambito informatico   ;open;CC-BY-4.0;txt;1_star;2685366025;2020-11-30
10.5281/zenodo.4297322;Studied disinfectant substances against SARS-CoV-2 and other coronaviruses;eng;en;ambito genomico;ambito clinico   ;open;CC-BY-4.0;xlsx;2_star;7036010;2021-05-06
10.5281/zenodo.4297443;The effects of social isolation among elderly people in nursing homes in Austria during the Covid-19 pandemic;deu;en;ambito psicologico;ambito psicologico   ;open;CC-BY-4.0;ods;2_star;293504;2020-11-30
10.5281/zenodo.4297574;BridgeDb: Human and SARS-related corona virus gene/protein mapping database derived from Wikidata;;low confidence;non definito;non definito;open;other-open;bridge;trascurato;127631402;2020-11-30
10.5281/zenodo.4298497;Kuesioner, hasil uji statistik validitas & reablitias dan isian kuesioner Pengetahuan dan sikap ibu hamil trimester III terhadap pencegahan COVID-19;;low confidence;non definito;non definito;open;CC-BY-4.0;docx;2_star;18817148;2021-02-07
10.5281/zenodo.4299144;ACE2 EXPRESSION LEVELS IN THE BRAIN AND EYE;eng;en;non definito;non definito;open;CC-BY-4.0;pdf;1_star;41112148;2020-12-02
10.5281/zenodo.4299967;Simulation results for Sars-CoV2 3C-like main protease:  TRAPP analysis of the binding site flexibility and results of the  docking study;;low confidence;non definito;non definito;open;CC-BY-4.0;csv,ipynb,xlsx,zip;3_star;38250999;2021-02-28
10.5281/zenodo.4304620;Data and code release for Carleton, Cornetet, Huybers, Meng & Proctor (forthcoming, PNAS), Global evidence for ultraviolet radiation decreasing COVID-19 growth rates;eng;en;ambito genomico;ambito epidemiologico   ;open;CC-BY-4.0;zip;non classificabile;30486240006;2020-12-04
