doi;title;language;language_detected;ambito_reale;ambito_detected;access_right;license;formati;star;volume;updated
10.1093/bioinformatics/btab160;FRC-QE: A robust and comparable 3D microscopy image quality metric for cleared organoids - image data;;en;non definito;non definito;open;CC-BY-4.0;zip;non classificabile;12125481075;2021-03-18
10.1101/2020.04.22.20075143;Detection of COVID-19 Infection from Routine Blood Exams with Machine Learning: a Feasibility Study;ita;en;ambito informatico;ambito clinico   ;open;CC-BY-2.0;pdf,xlsx;2_star;6079084146;2020-10-05
10.1101/2020.05.28.122648;Rapid and Inexpensive Whole-Genome Sequencing of SARS-CoV2 using 1200 bp Tiled Amplicons and Oxford Nanopore Rapid Barcoding;;low confidence;non definito;non definito;open;CC-BY-4.0;gz,tab;non classificabile;24301440;2020-07-03
10.1101/2020.11.09.20228858;Can we predict the severe course of COVID-19  – a systematic review and meta-analysis of indicators of clinical outcome?;;en;ambito epidemiologico;ambito epidemiologico   ;open;CC-BY-4.0;xlsx;2_star;4757604;2021-07-15
10.1101/2021.02.26.21252546;The accuracy of novel antigen rapid diagnostics for SARS-CoV-2: a living systematic review and meta-analysis.;;low confidence;non definito;non definito;open;CC-BY-4.0;xlsx;2_star;13292725;2021-07-12
10.1145/3383313.3412251;Towards Safety and Sustainability: Designing Local Recommendations for Post-pandemic World;eng;low confidence;non definito;non definito;open;CC-BY-4.0;csv,pdf;3_star;680388040;2020-09-23
10.1302/0301-620X.102B7.BJJ-2020-0808;Reinstating elective orthopaedic surgery in the age of COVID-19;;low confidence;non definito;non definito;open;CC-BY-4.0;xlsx;2_star;99187;2021-08-08
10.1515/cclm-2020-1294;Development, evaluation, and validation of machine learning models for COVID-19 detection based on routine blood tests;;en;ambito informatico;ambito epidemiologico   ;open;CC-BY-4.0;xlsx;2_star;123614447;2021-04-14
10.17605/OSF.IO/7PEYQ;Reddit Mental Health Dataset;eng;low confidence;non definito;non definito;open;ODC-PDDL-1.0;csv;3_star;181103128744;2020-10-16
10.21203/rs.3.rs-17218/v1;SARS-CoV-2 infected host cell proteomics reveal potential therapy targets;eng;low confidence;non definito;non definito;open;CC-BY-4.0;pdf,xlsx;2_star;77885787;2020-05-13
10.25338/B82G9B;0 ns and 75 ns configurations of glycosylated ACE2-FC and its interaction with SARS-CoV-2 binding domains;;en;non definito;non definito;open;CC0-1.0;pdb;3_star;52149402;2020-08-16
10.25338/B8C91C;Acids in Coffee - A Review of Sensory Measurements and Meta-Analysis of Chemical Composition;;en;altro;ambito genomico   ;open;CC0-1.0;csv,xlsx;3_star;14710873;2021-07-15
10.25338/B8M92X;Lipid mediators detected in COVID-19 patients and healthy controls;;en;ambito genomico;ambito genomico   ;open;CC0-1.0;xlsx;2_star;1086800;2021-03-27
10.25338/B8ZS7R;Davis Amtrak station pilot project evaluation;;en;non definito;non definito;open;CC0-1.0;csv,xlsx;3_star;338084;2021-01-12
10.25583/1760388;The SARS-CoV-2 Spike Variant D614G Favors an Open Conformational State;;en;ambito genomico;ambito genomico   ;open;CC-BY-4.0;zip;non classificabile;77389032098;2021-02-24
10.3390/ijerph17249533;Home-Based Resistance Training for Older Subjects during the COVID-19 Outbreak in Italy: Preliminary Results of a Six-Months RCT;eng;en;ambito clinico;ambito clinico   ;open;CC-BY-4.0;xlsx;2_star;96480;2021-02-24
10.3897/rio.7.e62936.suppl1;Supplementary material 1 from: Padilla-Sanchez V (2021) SARS-CoV-2 Structural Analysis of Receptor Binding Domain New Variants from United Kingdom and South Africa. Research Ideas and Outcomes 7: e62936. https://doi.org/10.3897/rio.7.e62936;;low confidence;non definito;non definito;open;CC0-1.0;mp4;non classificabile;82121040;2021-01-23
10.3897/rio.7.e62936.suppl2;Supplementary material 2 from: Padilla-Sanchez V (2021) SARS-CoV-2 Structural Analysis of Receptor Binding Domain New Variants from United Kingdom and South Africa. Research Ideas and Outcomes 7: e62936. https://doi.org/10.3897/rio.7.e62936;;low confidence;non definito;non definito;open;CC0-1.0;mp4;non classificabile;165518352;2021-01-23
10.3897/rio.7.e62936.suppl3;Supplementary material 3 from: Padilla-Sanchez V (2021) SARS-CoV-2 Structural Analysis of Receptor Binding Domain New Variants from United Kingdom and South Africa. Research Ideas and Outcomes 7: e62936. https://doi.org/10.3897/rio.7.e62936;;low confidence;non definito;non definito;open;CC0-1.0;mp4;non classificabile;175705705;2021-01-23
10.4995/wpom.15332;A data generator for COVID-19 patients' care requirements inside hospitals: data paper;eng;low confidence;non definito;non definito;open;CC-BY-4.0;zip;non classificabile;66569550;2021-04-19
10.5061/dryad.02v6wwpzr;SATURN: an inexpensive, freely-available, and fully self-administered cognitive screening test;;en;altro;ambito psicologico   ;open;CC0-1.0;csv,doc,docx,mp4,pptx,rar,xlsx,zip;3_star;129177906;2020-07-28
10.5061/dryad.08kprr52t;The use of nanobodies in a sensitive ELISA test for SARS-CoV-2 antigens;;en;non definito;non definito;open;CC0-1.0;docx,pzfx;2_star;1518798;2021-06-26
10.5061/dryad.0cfxpnw32;Effect of social media on mental health during Covid-19 lockdowns in India;;en;ambito psicologico;ambito psicologico   ;open;CC0-1.0;xlsx;2_star;159520;2021-09-18
10.5061/dryad.0k6djh9z4;Chum salmon escapement on Bonanza River in Norton Sound, Alaska;;en;non definito;non definito;open;CC0-1.0;txt,xlsx;2_star;1098560;2021-02-03
10.5061/dryad.0k6djhb1d;Comparing the first and second waves of COVID-19 in a tertiary university hospital in Barcelona;;en;ambito clinico;ambito clinico   ;open;CC0-1.0;xlsx;2_star;1775365;2021-09-11
10.5061/dryad.0vt4b8gzq;Accuracy of the mologic COVID-19 rapid antigen test-a prospective multi-centre analytical and clinical evaluation;;en;ambito genomico;ambito genomico   ;open;CC0-1.0;docx,xlsx;2_star;219784;2021-05-18
10.5061/dryad.18931zctb;Analysis of airline boarding changes in response to COVID-19;;en;altro;ambito informatico   ;open;CC0-1.0;zip;non classificabile;21201480;2021-04-23
10.5061/dryad.1c59zw3t0;Data for: Psychological distress, anxiety, suicidality, and wellbeing in New Zealand during the COVID-19 lockdown: a cross-sectional study;;en;non definito;non definito;open;CC0-1.0;csv;3_star;196524784;2020-09-10
10.5061/dryad.1ns1rn8rx;An interactive tool to forecast us hospital needs in the Coronavirus 2019 pandemic;;en;ambito informatico;ambito informatico   ;open;CC0-1.0;zip;non classificabile;7821308;2021-09-22
10.5061/dryad.1ns1rn8th;Air temperature influences early Covid-19 outbreak as indicated by worldwide mortality;;en;altro;ambito genomico   ;open;CC0-1.0;csv,txt;3_star;144014;2021-06-16
10.5061/dryad.1rn8pk0r4;Data from: Clinical management and mortality among COVID-19 cases in sub-Saharan Africa: a retrospective study from Burkina Faso and simulated case analysis.;;en;non definito;non definito;open;CC0-1.0;csv,pdf,txt;3_star;6674510;2020-06-24
10.5061/dryad.2547d7wnz;Data from: Immunoreactive peptide maps of SARS-CoV-2;;low confidence;non definito;non definito;open;CC0-1.0;csv,r,txt;3_star;1073016657;2021-07-12
10.5061/dryad.2547d7wpq;Data from: COVID-19 prevalence and predictors in United States adults during peak stay-at-home orders;;en;ambito epidemiologico;ambito epidemiologico   ;open;CC0-1.0;xlsx;2_star;13172312;2021-02-18
10.5061/dryad.2jm63xspf;Prisma checklist: Pharmacological management of seizures in patients with COVID-19: a systematic review;;low confidence;non definito;non definito;open;CC0-1.0;docx;2_star;0;2021-05-21
10.5061/dryad.2rbnzs7mk;Images of loop-mediated isothermal amplification (LAMP) for SARS-CoV-2 testing and optimized 'Cap-iLAMP';;low confidence;non definito;non definito;open;CC0-1.0;jpg,txt;1_star;30442216;2021-01-29
10.5061/dryad.34tmpg4j5;The influence of the global COVID-19 pandemic on manuscript submissions and editor and reviewer performance at six ecology journals;;en;non definito;non definito;open;CC0-1.0;xlsx;2_star;22508042;2020-12-17
10.5061/dryad.34tmpg4jq;Aerosol formation due to a dental procedure: Insights leading to the transmission of diseases to the environments;;en;non definito;non definito;open;CC0-1.0;dat,mat,mp4,txt;1_star;2462747685;2021-03-11
10.5061/dryad.37pvmcvh7;Serum 25(OH)D level on hospital admission is correlated with COVID-19 mortality;;en;ambito epidemiologico;ambito epidemiologico   ;open;CC0-1.0;docx;2_star;8338988;2020-10-21
10.5061/dryad.3bk3j9khg;How partisanship and public health concerns affect individuals' social mobility during COVID-19;;en;non definito;non definito;open;CC0-1.0;csv,pdf,r,rdata;3_star;7560417595;2020-11-17
10.5061/dryad.3n5tb2rg1;Indoor dust as a matrix for surveillance of COVID-19 outbreaks;;en;ambito genomico;ambito genomico   ;open;CC0-1.0;xlsm;trascurato;276316;2021-04-03
10.5061/dryad.3r2280gd5;Cardioespiratory physiological perturbations after acute smoke-induced lung injury and during extracorporeal membrane oxygenation support in sheep;;en;non definito;non definito;open;CC0-1.0;tif,xls,xlsx;2_star;1014270910;2020-08-11
10.5061/dryad.3tx95x6fc;Safe abortion services during COVID pandemic in Nepal;;en;non definito;non definito;open;CC0-1.0;sav,txt;1_star;139560;2021-02-03
10.5061/dryad.47d7wm3dt;Influence of COVID‑19 on the prognosis and medication compliance of glaucoma patients in the Nile Delta Region;;en;ambito epidemiologico;ambito epidemiologico   ;open;CC0-1.0;doc;trascurato;155648;2021-09-15
10.5061/dryad.4f4qrfjbm;Timing the SARS-CoV-2 index case in Hubei Province;;en;ambito epidemiologico;ambito genomico   ;open;CC0-1.0;zip;non classificabile;5975237056;2021-03-10
10.5061/dryad.4j0zpc89z;SARS-CoV-2 viability after exposure to titanium dioxide coated tiles;;en;altro;ambito epidemiologico   ;open;CC0-1.0;xlsx,zip;2_star;11509;2021-02-23
10.5061/dryad.4mw6m907n;Data from: From trial to implementation, bringing team-based learning online – Duke-NUS Medical School's response to the COVID-19 pandemic;;en;altro;ambito informatico   ;open;CC0-1.0;docx,xlsx;2_star;1463711;2020-06-15
10.5061/dryad.4qrfj6q79;Viruses harness YxxØ motif to interact with host AP2M1 for replication: A vulnerable broad-spectrum antiviral target;;en;ambito genomico;ambito genomico   ;open;CC0-1.0;pdf,xlsx;2_star;13053066;2020-09-01
10.5061/dryad.4qrfj6q7p;Data from: Early postmortem brain MRI findings in COVID-19 non-survivors;;en;ambito clinico;ambito clinico   ;open;CC0-1.0;pdf;1_star;25968240;2020-06-22
10.5061/dryad.4tmpg4f81;Flick SMART multi-catch rodent station and bait station data sets: Council of the city of Sydney, October 2019 to July 2020;;en;non definito;non definito;open;CC0-1.0;csv;3_star;10431690;2020-11-19
10.5061/dryad.59zw3r27n;Telerehabilitation program for COVID-19 survivors (TERECO) - Randomized controlled trial;;en;ambito clinico;ambito clinico   ;open;CC0-1.0;csv,dta,pdf;3_star;432176;2021-07-12
10.5061/dryad.5hqbzkh3g;On the evolutionary epidemiology of SARS-CoV-2;;en;ambito genomico;ambito epidemiologico   ;open;CC0-1.0;cdf,nb,pdf;1_star;183459986;2020-07-28
10.5061/dryad.5hqbzkh6f;A multi-modal sensor dataset for continuous stress detection of nurses in a hospital;;en;ambito clinico;ambito clinico   ;open;CC0-1.0;xlsx,zip;2_star;1157184782;2021-09-18
10.5061/dryad.66t1g1k01;Data from: Initial experiences of US neurologists in practice during the COVID-19 pandemic via survey;;en;altro;ambito clinico   ;open;CC0-1.0;csv,pdf;3_star;80786024;2020-06-03
10.5061/dryad.69p8cz91t;Diameter measurements of 14 Eastern White Pine (Pinus strobus) at Fish Lake Environmental Education Center (Eastern Michigan University; Lapeer County, Michigan, USA);en;non definito;non definito;open;CC0-1.0;xlsx;2_star;56096;2021-05-03
10.5061/dryad.69p8cz922;Social media and public perception as core aspect of public health: the cautionary case of @realdonaldtrump and COVID-19;;en;social network;social network   ;open;CC0-1.0;txt,xlsx;2_star;25135055;2021-05-12
10.5061/dryad.6m905qg0s;The correlation between education levels and COVID-19 vaccination in Turkey;;en;ambito epidemiologico;ambito epidemiologico   ;open;CC0-1.0;csv,txt;3_star;19728;2021-08-26
10.5061/dryad.6t1g1jwxj;Longitudinal proteomic profiling of high-risk patients with COVID-19 reveals markers of severity and predictors of fatal disease;;en;ambito genomico;ambito genomico   ;open;CC0-1.0;csv,pdf;3_star;199484154;2020-11-24
10.5061/dryad.6wwpzgmwc;Data from: Tradeoffs in moving citizen-based anuran call surveys online during the SARS-CoV-2 pandemic: lessons from rural Appalachia, USA;;en;non definito;non definito;open;CC0-1.0;xlsx;2_star;0;2021-07-31
10.5061/dryad.70rxwdbv5;Supplementary material from Possible fates of the dispersion of SARS-COV-2 in the Mexican context;;en;non definito;non definito;open;CC0-1.0;nb;trascurato;8776248;2020-09-11
10.5061/dryad.79cnp5hsp;Data from: Impact of a novel community testing pathway for people with suspected COVID-19 in Wales: a cost-minimisation analysis;;en;non definito;non definito;open;CC0-1.0;xlsx;2_star;2225010;2020-08-10
10.5061/dryad.7d7wm37sz;Neurologic complications of COVID-19;;en;ambito epidemiologico;ambito psicologico   ;open;CC0-1.0;rtf,txt,xlsx;2_star;32144687;2021-02-02
10.5061/dryad.7h44j0zrj;Coronavirus testing indicates transmission risk increases along wildlife supply chains for human consumption in Viet Nam, 2013-2014;;en;non definito;non definito;open;CC0-1.0;csv;3_star;187561176;2020-09-11
10.5061/dryad.7pvmcvdt0;FASTA sequences of 6 different proteins of SARS-CoV-2;;en;ambito genomico;ambito genomico   ;open;CC0-1.0;docx;2_star;0;2021-07-16
10.5061/dryad.866t1g1pb;Prolonged unconsciousness following severe COVID-19;;en;ambito clinico;ambito clinico   ;open;CC0-1.0;docx;2_star;70485;2021-03-19
10.5061/dryad.8cz8w9gpb;Large scale virtual screening for finding inhibitor against the main protease from herbal medicine for SARS-Cov2 therapy;;en;ambito epidemiologico;ambito genomico   ;open;CC0-1.0;in,zip;non classificabile;2085985639;2021-01-15
10.5061/dryad.8pk0p2nkk;Genotype count for all coding variants in type I IFN genes investigated in 659 life-threatening COVID-19 patients and 534 asymptomatic/mild infected controls;;low confidence;non definito;non definito;open;CC0-1.0;txt,xlsx;2_star;1042470;2020-10-08
10.5061/dryad.8w9ghx3kc;Rapid behavioural response of urban birds to COVID-19 lockdown;;en;non definito;non definito;open;CC0-1.0;txt;1_star;13641618;2021-02-20
10.5061/dryad.905qfttjm;COVID-CDR: An integrative resource for network-based investigation of COVID-19 combinatorial drug repositioning and mechanism of action;;en;non definito;non definito;open;CC0-1.0;csv,rds,xlsx;3_star;483820027;2020-12-04
10.5061/dryad.905qfttk2;A case report on concurrent catatonia in a man with COVID-19;;en;ambito psicologico;ambito psicologico   ;open;CC0-1.0;pdf;1_star;1591884;2021-02-27
10.5061/dryad.931zcrjhs;COVID-19 clinician moral injury survey;;en;non definito;non definito;open;CC0-1.0;xlsx;2_star;2249610;2020-10-08
10.5061/dryad.931zcrjjp;Test of perfluorodecalin to increase transdermal oxygen delivery in mice;;en;ambito genomico;ambito genomico   ;open;CC0-1.0;,csv;3_star;71129;2021-03-12
10.5061/dryad.9ghx3ffhf;Preterm birth is not associated with asymptomatic/mild SARS-CoV-2 infection per se: pre-pregnancy state is what matters;;en;ambito clinico;ambito clinico   ;open;CC0-1.0;xlsx;2_star;317905;2021-08-06
10.5061/dryad.9kd51c5dk;Targeting the glycan of receptor binding domain with jacalin as a novel approach to developing treatment against COVID-19;;en;non definito;non definito;open;CC0-1.0;pdb;3_star;4050197;2020-08-25
10.5061/dryad.9kd51c5hk;Daily United States COVID-19 Testing and Outcomes Data By State, March 7, 2020 to March 7, 2021;;en;ambito epidemiologico;ambito epidemiologico   ;open;CC0-1.0;csv,md;3_star;33366123;2021-07-29
10.5061/dryad.b8gtht799;Data from: Estimating transmission dynamics and serial interval of the first wave of COVID-19 infections under different control measures: A statistical analysis in Tunisia from February 29 to May 5, 2020;;en;non definito;non definito;open;CC0-1.0;csv;3_star;604153;2020-10-10
10.5061/dryad.b8gtht79q;Engaging online students by activating ecological knowledge;;en;altro;ambito genomico   ;open;CC0-1.0;xlsx;2_star;629505;2021-08-18
10.5061/dryad.bcc2fqzbx;Knowledge and awareness of Covid-19 in eye care;;en;non definito;non definito;open;CC0-1.0;xlsx;2_star;401520;2021-07-20
10.5061/dryad.brv15dv8h;Comparative evaluation of ten lateral flow immunoassays to detect SARS-CoV-2 antibodies;;en;ambito genomico;ambito genomico   ;open;CC0-1.0;pdf,xlsx;2_star;2618676;2021-02-03
10.5061/dryad.c59zw3r5n;Coronavirus prevalence in Brazilian Amazon and Sao Paulo city;;en;non definito;non definito;open;CC0-1.0;zip;non classificabile;604895704;2020-12-09
10.5061/dryad.c866t1g67;Investigation of Long COVID Prevalence and Its Relationship to Epstein-Barr Virus Reactivation;;en;ambito clinico;ambito clinico   ;open;CC0-1.0;xlsx;2_star;470910;2021-06-18
10.5061/dryad.c866t1g79;OHSU 2019-2020 utilization of ambulatory telehealth and office visits by patient demographics;;en;non definito;non definito;open;CC0-1.0;csv,txt;3_star;20193;2021-07-06
10.5061/dryad.cnp5hqc2r;Factors associated with COVID-19 infections and mortality in Africa: A cross-sectional study using publicly available data;;en;non definito;non definito;open;CC0-1.0;xlsx;2_star;301340;2020-10-23
10.5061/dryad.cnp5hqc5h;COVID-19 Vaccination perceptions of HCWs;;en;ambito psicologico;ambito epidemiologico   ;open;CC0-1.0;xlsx;2_star;753132;2021-09-21
10.5061/dryad.cvdncjt21;Data from: Disparate patterns of movements and visits to points of interest located in urban hotspots across U.S. metropolitan cities during COVID-19;;en;altro;ambito informatico   ;open;CC0-1.0;csv,ds_store,pkl,png;3_star;927566307;2020-12-15
10.5061/dryad.cvdncjt4t;The impact of long-term non-pharmaceutical interventions on COVID-19 epidemic dynamics and control: the value and limitations of early models;;en;non definito;non definito;open;CC0-1.0;txt,zip;1_star;7192254734;2021-08-28
10.5061/dryad.d2547d821;Outdoor activity participation improves adolescents' mental health and well-being during the COVID-19 pandemic;;en;non definito;non definito;open;CC0-1.0;csv,do,txt;3_star;11027367;2020-11-21
10.5061/dryad.dv41ns1vq;Data from: COVID-19-related encephalopathy responsive to high doses glucocorticoids;;low confidence;non definito;non definito;open;CC0-1.0;pdf;1_star;500959;2021-08-05
10.5061/dryad.dv41ns1xk;Association of ABO blood groups with presentation and outcomes of confirmed SARS CoV-2 infection: A prospective study in the largest COVID-19 dedicated hospital in Bangladesh;;en;ambito epidemiologico;ambito clinico   ;open;CC0-1.0;docx,sav;2_star;249816;2021-03-20
10.5061/dryad.dv41ns1xr;Ivermectin for COVID-19 in Peru: 14-fold reduction in nationwide excess deaths, p<0.002 for effect by state, then 13-fold increase after ivermectin use restricted;;en;ambito clinico;ambito clinico   ;open;CC0-1.0;csv,pdf,xlsx;3_star;284974826;2021-04-28
10.5061/dryad.f1vhhmgv6;The scale and dynamics of COVID-19 epidemics across Europe;;en;ambito epidemiologico;ambito epidemiologico   ;open;CC0-1.0;xls,xlsm,xlsx;2_star;178956011;2020-10-15
10.5061/dryad.ffbg79crq;Characterisation data for electrocharged facepiece respirator fabrics using common materials;;en;non definito;non definito;open;CC0-1.0;tif,txt;1_star;40789018;2020-11-17
10.5061/dryad.fttdz08rp;Ivermectin as a potential treatment for mild to moderate COVID-19 – A double blind randomized placebo-controlled trial;;en;ambito genomico;ambito clinico   ;open;CC0-1.0;xlsx;2_star;995148;2021-01-13
10.5061/dryad.fxpnvx0rm;Mammals, wildlife trade, and the next global pandemic;;en;ambito genomico;ambito genomico   ;open;CC0-1.0;nex,txt;1_star;52278517;2021-05-27
10.5061/dryad.ghx3ffbpg;Use of medicinal plants for COVID-19 prevention and respiratory symptom treatment during the pandemic in Cusco, Peru: A cross-sectional survey;;en;ambito clinico;ambito psicologico   ;open;CC0-1.0;csv,txt;3_star;533202;2021-09-21
10.5061/dryad.gmsbcc2mp;EEG abnormalities and their radiographic correlates in a COVID-19 inpatient cohort;;en;ambito psicologico;ambito psicologico   ;open;CC0-1.0;csv,txt;3_star;231832;2021-08-26
10.5061/dryad.h70rxwdgv;Fear of COVID-19 during confinement in Mauritius: a survey-based study;;en;ambito psicologico;ambito psicologico   ;open;CC0-1.0;xlsx;2_star;235365;2020-10-27
10.5061/dryad.h70rxwdjq;Scheduling Mechanisms to Control Spread of Covid-19 (Simulation Results);;en;ambito epidemiologico;ambito genomico   ;open;CC0-1.0;csv,txt;3_star;26055;2021-06-24
10.5061/dryad.h70rxwdjv;Mental Stability During Covid Crisis-DASS Index 21-  Chess Players and Non Chess Players;;en;ambito psicologico;ambito psicologico   ;open;CC0-1.0;xlsx;2_star;753763;2021-08-02
10.5061/dryad.hmgqnk9h8;Mountain lions reduce movement, increase efficiency during the COVID-19 shutdown;;en;non definito;non definito;open;CC0-1.0;csv,txt;3_star;11337824;2021-07-10
10.5061/dryad.hqbzkh1f9;Diffusion segregation and the disproportionate incidence of COVID-19 in African American communities;;en;non definito;non definito;open;CC0-1.0;zip;non classificabile;141906406;2020-12-23
10.5061/dryad.ht76hdrg2;Knowledge and attitude of infection prevention and control practices among health care workers caring for patients with suspected or confirmed COVID-19;;en;ambito epidemiologico;ambito epidemiologico   ;open;CC0-1.0;xlsx;2_star;711788;2021-07-09
10.5061/dryad.jsxksn077;Analysis of measles-mumps-rubella (MMR) titers of recovered COVID-19 patients;;en;ambito clinico;ambito epidemiologico   ;open;CC0-1.0;xlsx;2_star;314664;2020-10-03
10.5061/dryad.jsxksn09n;DATASET: Forecast made on January 11, 2021 for the second Covid-19 wave based on the improved SIR model with a constant ratio of recovery to infection rate;;en;non definito;non definito;open;CC0-1.0;,csv;3_star;1641879;2021-08-16
10.5061/dryad.k0p2ngf6b;Systemic corticosteroids and mortality in severe and critical COVID-19 patients in Wuhan, China;;en;ambito clinico;ambito clinico   ;open;CC0-1.0;docx;2_star;641069;2020-10-08
10.5061/dryad.k6djh9w5h;Survey of software engineering in code used in published papers;;en;ambito informatico;ambito informatico   ;open;CC0-1.0;,js,pdf,tex;1_star;1105455;2021-02-08
10.5061/dryad.kd51c5b43;Online program metrics and evaluation for FMNP and NATA;;en;non definito;non definito;open;CC0-1.0;docx,xlsx;2_star;418943;2021-09-12
10.5061/dryad.ksn02v749;Optimal test-assisted quarantine strategies for COVID-19;;en;ambito genomico;ambito epidemiologico   ;open;CC0-1.0;xlsx;2_star;1299627;2021-05-25
10.5061/dryad.ksn02v74n;Concordance between PCR-based extraction-free saliva and nasopharyngeal swabs for SARS-CoV-2 testing;;en;ambito genomico;ambito genomico   ;open;CC0-1.0;xlsx;2_star;39915;2021-07-12
10.5061/dryad.m0cfxpp3g;Post COVID syndrome among symptomatic COVID-19 patients: a prospective study in a tertiary care center in Bangladesh;;en;ambito clinico;ambito psicologico   ;open;CC0-1.0;docx,sav;2_star;132178;2021-09-27
10.5061/dryad.m37pvmd1n;Adherence to wearing facemasks during the COVID-19 pandemic;;en;non definito;non definito;open;CC0-1.0;docx,sav;2_star;259620;2021-02-13
10.5061/dryad.mcvdnck12;Characteristics of patients admitted to hospital with COVID-19 during the first wave of the pandemic in Malta;;en;ambito clinico;ambito clinico   ;open;CC0-1.0;xlsx;2_star;181480;2021-05-03
10.5061/dryad.n02v6wwxh;Spatial dynamics of pathogen transmission in communally roosting species: Impacts of changing habitats on bat-virus dynamics;;en;ambito genomico;ambito genomico   ;open;CC0-1.0;csv,txt;3_star;16916;2021-06-30
10.5061/dryad.n5tb2rbt5;Stroke risk, phenotypes, and death in COVID-19: systematic review and newly reported cases;;en;ambito epidemiologico;ambito genomico   ;open;CC0-1.0;pdf;1_star;3302010;2021-08-29
10.5061/dryad.n8pk0p2sd;Data from: Footprint of the host restriction factors APOBEC3 on the genome of human viruses;;en;ambito epidemiologico;ambito genomico   ;open;CC0-1.0;txt;1_star;362853408;2020-07-28
10.5061/dryad.nk98sf7qx;New onset neurologic events in people with COVID-19 infection in three regions in China;;en;ambito psicologico;ambito psicologico   ;open;CC0-1.0;docx;2_star;699771;2020-10-08
10.5061/dryad.nk98sf7rq;Data from: Vitamin D status and COVID-19 clinical outcomes in hospitalized patients;;en;ambito epidemiologico;ambito epidemiologico   ;open;CC0-1.0;docx;2_star;210904;2021-01-06
10.5061/dryad.nk98sf7rz;Data from  social learning development, during COVID-19 how international students use media platforms as crowdsource technology to solve learning difficulties;;en;non definito;non definito;open;CC0-1.0;csv,sav,spv;3_star;9944453;2020-10-14
10.5061/dryad.np5hqbzsh;Study of floral visitation on Leea asiatica;;en;non definito;non definito;open;CC0-1.0;mp4,xlsx;2_star;877573591;2021-03-23
10.5061/dryad.pc866t1pf;Safe traveling in public transport amid COVID-19;;en;non definito;non definito;open;CC0-1.0;txt,zip;1_star;56042466;2021-08-26
10.5061/dryad.pg4f4qrmj;Data from: Lessons from movement ecology for the return to work: modeling contacts and the spread of COVID-19;;en;altro;ambito genomico   ;open;CC0-1.0;txt,zip;1_star;2736964;2020-09-05
10.5061/dryad.pg4f4qrn3;Coagulation profile of COVID-19 patients admitted to the ICU: an exploratory study;;en;non definito;non definito;open;CC0-1.0;;trascurato;296504;2020-10-27
10.5061/dryad.pk0p2ngm7;SARS-CoV-2 encephalitis presenting as a clinical cerebellar syndrome: a case report;;low confidence;non definito;non definito;open;CC0-1.0;pdf;1_star;84771;2021-07-13
10.5061/dryad.q2bvq83gv;Data from: Pediatric intensive care unit admissions for COVID-19: insights using state-level data;;en;ambito epidemiologico;ambito psicologico   ;open;CC0-1.0;xlsx;2_star;1957754;2020-07-29
