doi;title;language;language_detected;ambito_reale;ambito_detected;access_right;license;formati;star;volume;updated
10.5281/zenodo.4915646;IR spectra of COVID-2019 virus (SARS-CoV-2) protein.;;en;non definito;non definito;open;CC-BY-4.0;zip;non classificabile;6228012595;2021-06-10
10.5281/zenodo.4915950;CATH Functional Families assignments for SARS-CoV-2, SARS-CoV and MERS proteins;;en;ambito genomico;ambito genomico   ;open;CC-BY-4.0;crh,json;3_star;0;2021-06-10
10.5281/zenodo.4916131;Underlying and extended data for: Increase of SARS-CoV-2 RNA load in faecal samples prompts for rethinking of SARS-CoV-2 biology and COVID-19 epidemiology.;;low confidence;non definito;non definito;open;CC-BY-4.0;zip;non classificabile;21957266;2021-06-10
10.5281/zenodo.4924061;The Impact of Working From Home on the Success of Scrum Projects: A Multi-Method Study;eng;en;non definito;non definito;open;CC-BY-4.0;zip;non classificabile;16720804;2021-06-11
10.5281/zenodo.4925646;Data for COVID-19 vaccine review;;low confidence;non definito;non definito;open;CC-BY-4.0;r,xlsx;3_star;50303;2021-06-11
10.5281/zenodo.4926233;SARS-CoV-2 Spike Structure Vector Analysis Scripts and Molecular dynamics simulation trajectories for the SARS-CoV-2 WT and Mut (K417N+E484K+N501Y) RBDs;;low confidence;non definito;non definito;open;CC-BY-4.0;py,tcl;3_star;5397;2021-06-24
10.5281/zenodo.4927984;Sars-CoV-2 structures -- sequence-to-alignments derived from PDB and from PSSH2 plus dark regions;eng;en;ambito genomico;ambito genomico   ;open;CC-BY-4.0;gz;non classificabile;6424742394;2021-06-30
10.5281/zenodo.4934861;Sars-CoV-2 structures -- sequence-to-alignments derived from PDB and from PSSH2, plus dark regions;eng;en;ambito genomico;ambito genomico   ;open;CC-BY-4.0;csv,gz;3_star;705757;2021-06-15
10.5281/zenodo.4939648;Dataset: A Mini-Review of the Molecular Docking Study of SARS-CoV-2 with Phytochemicals from Medicinal Plants;eng;low confidence;non definito;non definito;open;CC-BY-4.0;xlsx;2_star;40389;2021-06-13
10.5281/zenodo.4939978;Machine Learning for Outbreak Prediction, based on Outbreak-Data of other 6 Countries (In the passage of atmospheric oceanic iodine);;low confidence;non definito;non definito;open;CC-BY-4.0;arff,pdf;1_star;3163966;2021-06-15
10.5281/zenodo.4940189;COVID-19 suppression of human mobility releases mountain lions from a landscape of fear: dataset and code;;low confidence;non definito;non definito;open;CC-BY-4.0;r,rdata;3_star;168868715;2021-06-14
10.5281/zenodo.4944064;SARS-CoV-2 Amplicon Sequence Analysis Tutorial;;low confidence;non definito;non definito;open;CC-BY-4.0;bed,fasta,gz;3_star;3453861839;2021-06-14
10.5281/zenodo.4956920;Topic detection and sentiment analysis in Twitter content related to COVID-19 from Brazil and the USA - Dataset;eng;low confidence;non definito;non definito;open;CC-BY-4.0;zip;non classificabile;131108411;2021-06-16
10.5281/zenodo.4959224;tshrum/AltruismEnvironmentalismCOVIDBehavior: AltruismEnvironmentalismCOVIDBehavior;;low confidence;non definito;non definito;open;other-open;zip;non classificabile;0;2021-06-16
10.5281/zenodo.4968578;Covid-Graph-Repository: Graph Dumps and Topology Results;;low confidence;non definito;non definito;open;other-open;zip;non classificabile;370132990;2021-06-18
10.5281/zenodo.4971313;An artificial intelligence nanopore platform for SARS-CoV-2 virus detection;eng;low confidence;non definito;non definito;open;CC-BY-4.0;pdf,zip;1_star;49457689253;2021-06-18
10.5281/zenodo.4982052;Data of CP in COVID-19 patients;eng;low confidence;non definito;non definito;open;CC-BY-1.0;xlsx;2_star;790710;2021-06-18
10.5281/zenodo.4984272;Characterisation of protease activity duringSARS-CoV-2 infection identifies novel viralcleavage sites and cellular targets withtherapeutic potential;;en;ambito genomico;ambito genomico   ;open;CC-BY-4.0;zip;non classificabile;1278452458;2021-06-19
10.5281/zenodo.4986365;TweetsCOV19 - Geolocation Data (Part 1, October 2019 - April 2020);;low confidence;non definito;non definito;open;CC-BY-4.0;zip;non classificabile;18599688;2021-06-19
10.5281/zenodo.4994110;Dataset: Macro-Level Drivers of SARS-CoV-2 Transmission;;low confidence;non definito;non definito;open;CC-BY-4.0;zip;non classificabile;0;2021-07-05
10.5281/zenodo.5011448;Global health science leverages established collaboration network to fight COVID-19;;en;non definito;non definito;open;CC-BY-4.0;zip;non classificabile;5075093460;2021-06-23
10.5281/zenodo.5012680;Google Trends normalized hits for COVID-19 generated in Switzerland;;low confidence;non definito;non definito;open;CC-BY-4.0;xlsm;trascurato;460426;2021-06-23
10.5281/zenodo.5013620;Population disruption: estimating changes in population distribution in the UK during the COVID-19 pandemic - Estimates for Local Authority Districts;eng;en;non definito;non definito;open;CC-BY-4.0;csv;3_star;210527928;2021-06-23
10.5281/zenodo.5018260;Deep spatial profiling of human COVID-19 brains;;en;non definito;non definito;open;CC-BY-4.0;txt,zip;1_star;19505013171;2021-07-09
10.5281/zenodo.5020082;COVID-19 Vaccine Tweets  in Turkish;;low confidence;non definito;non definito;open;CC-BY-4.0;txt,zip;1_star;87214243;2021-06-24
10.5281/zenodo.5020797;pourmalek/covir2: 2.2 public release;eng;low confidence;non definito;non definito;open;other-open;zip;non classificabile;298383295;2021-06-24
10.5281/zenodo.5027420;Dataset of Psychological Impact of the COVID-19 Pandemic on Families of People with Severe Mental Disorders in Brazil;por;en;ambito psicologico;ambito psicologico   ;open;CC-BY-4.0;xlsx;2_star;98499;2021-06-25
10.5281/zenodo.5033811;Supplementary Data for Ongoing Global and Regional Adaptive Evolution of SARS-CoV-2;;low confidence;non definito;non definito;open;CC-BY-4.0;tgz,tre,txt;1_star;23862063;2021-06-26
10.5281/zenodo.5036687;Training data for Identification of allelic variants in SARS-CoV-2 from deep sequencing reads;;en;non definito;non definito;open;CC-BY-4.0;bed6,fasta,gz,tabular;3_star;282013280416;2021-06-28
10.5281/zenodo.5038657;Epidemiology, Biodiversity, and Technological Trajectories in the Brazilian Amazon: From Malaria to COVID-19;;low confidence;non definito;non definito;open;CC-BY-4.0;csv;3_star;309095;2021-06-29
10.5281/zenodo.5040099;A vaccine-induced public antibody protects against SARS-CoV-2 and emerging variants;;en;non definito;non definito;open;CC-BY-4.0;gz,tsv;3_star;413215567;2021-08-24
10.5281/zenodo.5040829;Monte-Carlo simulations of aerosol-based exposure to SARS-CoV-2 in a shop/bar;;low confidence;non definito;non definito;open;CC-BY-4.0;gz;non classificabile;606539574;2021-07-02
10.5281/zenodo.5042252;SARS-CoV-2 mRNA vaccines induce persistent human germinal centre responses;;en;non definito;non definito;open;CC-BY-4.0;gz,tsv;3_star;9658258;2021-07-01
10.5281/zenodo.5044247;Rapid Creation of a Data Product for the World's Specimens of Horseshoe Bats and Relatives, a Known Reservoir for Coronaviruses;eng;en;altro;ambito informatico   ;open;CC-PDDC;csv,ods,pdf,r,txt,xlsx,zip;3_star;7106154051;2021-06-30
10.5281/zenodo.5052691;Molecular Dynamics Simulation of SARS-CoV-2 Spike Protein;;en;non definito;non definito;open;CC-BY-4.0;pdb,xtc;3_star;8600856116;2021-07-02
10.5281/zenodo.5062837;Co2 concentration, temperature and humidity in primary classrooms during the Covid-19 Safety Measures in Spain;;en;non definito;non definito;open;CC-BY-4.0;csv;3_star;45724825;2021-08-23
10.5281/zenodo.5062873;Vacinação contra Covid: tabulação de vacinas Astrazeneca de oito lotes vencidos;;pt;non definito;non definito;open;CC-BY-4.0;xlsx;2_star;813736776;2021-07-03
10.5281/zenodo.5068463;E-learning Data Archive;eng;en;non definito;non definito;open;CC-BY-4.0;xls;2_star;4129280;2021-07-08
10.5281/zenodo.5070416;Rtlive.de Nowcasting Results: DE until 2021-05-31;;en;ambito genomico;ambito genomico   ;open;AGPL-3.0;zip;non classificabile;44919748058;2021-07-06
10.5281/zenodo.5070957;Simulation results for COVID-19 vaccination in Sindh Province, Pakistan: a modelling study of health impact and cost-effectiveness;eng;en;ambito informatico;ambito genomico   ;open;CC-BY-4.0;xz;trascurato;31572793728;2021-07-06
10.5281/zenodo.5073680;Brazilian Portuguese COVID-19 Tweets;por;low confidence;non definito;non definito;open;CC-BY-4.0;csv;3_star;197912927264;2021-07-15
10.5281/zenodo.5081625;Prolonged Stress Causes Depression in Frontline Workers Fac-ing the COVID-19 Pandemic;;low confidence;non definito;non definito;open;CC-BY-4.0;sav;trascurato;66660;2021-07-09
10.5281/zenodo.5090519;WORK-LIFE BALANCE OF THE EMPLOYED POPULATION DURING THE EMERGENCY SITUATION OF COVID-19 IN LATVIA;eng;en;non definito;non definito;open;CC-BY-4.0;docx,sav;2_star;24028545;2021-07-11
10.5281/zenodo.5090755;Supplemental Material: Page Length Calculations for BMJ EBM Manuscript on COVID-19 Vaccine Transparency;eng;low confidence;non definito;non definito;open;CC-BY-4.0;xlsx;2_star;186970;2021-08-03
10.5281/zenodo.5091828;Data set for AYUSH interventions for COVID-19- A Living Systematic Review and Meta-analysis;eng;en;ambito clinico;ambito clinico   ;open;CC-BY-4.0;docx,xlsx;2_star;269711;2021-07-16
10.5281/zenodo.5092850;Covid-IF Training Data;;en;non definito;non definito;open;CC-BY-4.0;zip;non classificabile;4114993984;2021-07-13
10.5281/zenodo.5093027;COVID-19 Taxonomy Graph;;low confidence;non definito;non definito;open;CC-BY-4.0;txt;1_star;49180;2021-07-13
10.5281/zenodo.5093688;Looking in the medicine cabinet: methods for using real-world data to assess the impact of measles, mumps and rubella (MMR) and recombinant adjuvanted varicella-zoster vaccines on coronavirus disease 2019 (COVID-19) prevention and case fatality;;low confidence;non definito;non definito;open;CC-BY-4.0;csv,docx,r;3_star;1035450979;2021-08-20
10.5281/zenodo.5094460;Reporting uncertified science in the news media during the Covid-19 pandemic;;en;non definito;non definito;open;CC-BY-4.0;zip;non classificabile;0;2021-07-13
10.5281/zenodo.5094969;SET DE TWEETS FRANCOPHONES RELATIF A LA CRISE DE COVID-19 A DES FINS DE RECHERCHE;fra;fr;non definito;non definito;open;CC-BY-4.0;csv,pdf;3_star;147773285;2021-07-13
10.5281/zenodo.5095284;mit-ll/AlphaSeq_Antibody_Dataset: Initial release of AlphaSeq Antibody Dataset;eng;low confidence;non definito;non definito;open;CC-BY-4.0;zip;non classificabile;41684694;2021-07-14
10.5281/zenodo.5101191;COVID-19's lockdown and time allocation in Russian households;eng;en;non definito;non definito;open;CC-BY-4.0;xlsx;2_star;2650758;2021-07-16
10.5281/zenodo.5101817;Platforms & registries for sharing participant-level COVID-19 data;;low confidence;non definito;non definito;open;CC-BY-4.0;xlsx;2_star;1731580;2021-07-14
10.5281/zenodo.5104221;Sequences of different Coronavirus groups, including Receptor Binding Domains inferred from ancestors to SARS-CoV-2;;low confidence;non definito;non definito;open;CC-BY-4.0;fas,xlsx;2_star;27455;2021-07-15
10.5281/zenodo.5104289;Data for Paris Agreement requires substantial, broad, and sustained engagements beyond COVID-19 recovery packages;;low confidence;non definito;non definito;open;CC-BY-4.0;xlsx;2_star;33072;2021-07-15
10.5281/zenodo.5105921;CSV-format data for: Increased mortality in community-tested cases of SARS-CoV-2 lineage B.1.1.7;;low confidence;non definito;non definito;open;CC-BY-4.0;zip;non classificabile;976440091;2021-07-15
10.5281/zenodo.5106615;Dataset for the manuscript Marmet, Wicki, Gmel, Gachoud, Daeppen, Bertholet, Studer (2021). The psychological impact of the COVID-19 crisis is higher among young Swiss men with a lower socioeconomic status: evidence from a cohort study. Plos One. DOI:10.1371/journal.pone.0255050;;low confidence;non definito;non definito;open;CC-BY-4.0;csv;3_star;712892;2021-07-16
10.5281/zenodo.5108977;Data for manuscript Prevalence in News Media of two Competing Hypotheses about COVID-19 Origins;eng;en;non definito;non definito;open;CC-BY-4.0;rar;non classificabile;4313224440;2021-08-26
10.5281/zenodo.5109090;Prisma P Checklist of protocol - AYUSH interventions for COVID-19 - A Living Systematic Review and Meta-analysis;eng;en;ambito clinico;ambito clinico   ;open;CC-BY-4.0;doc;trascurato;162816;2021-07-16
10.5281/zenodo.5110039;Perceived stress and e-learning readiness data set during COVID-19;eng;en;ambito psicologico;ambito psicologico   ;open;CC-BY-4.0;xls;2_star;5838336;2021-07-17
10.5281/zenodo.5110071;Evidence summary on activities or settings associated with a higher risk of SARS-CoV-2 transmission: Summary of included evidence syntheses;;en;non definito;non definito;open;CC-BY-4.0;docx;2_star;83002;2021-07-19
10.5281/zenodo.5110098;Dataset defining representative route network for GLOWOPT market segments;eng;en;non definito;non definito;open;CC-BY-4.0;csv,mat,png;3_star;13713515;2021-07-21
10.5281/zenodo.5116476;An evaluation of RT-qPCR primer-probe sets to inform public health interventions based on COVID-19 sewage tests;;en;ambito informatico;ambito epidemiologico   ;open;CC-BY-4.0;xlsx;2_star;663141;2021-07-21
10.5281/zenodo.5118029;The Ultraviolet Beach Corpus;eng;low confidence;non definito;non definito;open;CC-BY-4.0;txt;1_star;14132439;2021-07-21
10.5281/zenodo.5118956;Supplementary File_Ivermectin_Risk of Bias Excel Tool (Version 1);eng;low confidence;non definito;non definito;open;CC-BY-4.0;xlsm;trascurato;48547597;2021-07-21
10.5281/zenodo.5119633;CD8+ T cell signature in acute SARS-CoV-2 infection identifies memory precursors;;en;non definito;non definito;open;CC-BY-4.0;zip;non classificabile;276584948;2021-07-22
10.5281/zenodo.5120023;https://github.com/owid/covid-19-data;;low confidence;non definito;non definito;open;other-open;zip;non classificabile;0;2021-07-22
10.5281/zenodo.5121217;The impact of the COVID-19 pandemic on scientific research in the life sciences;;en;non definito;non definito;open;CC-BY-4.0;md,zip;non classificabile;0;2021-07-31
10.5281/zenodo.5136342;synthetic dataset covid-19 PER;;low confidence;non definito;non definito;open;CC-BY-4.0;csv;3_star;4668849003;2021-07-26
10.5281/zenodo.5136854;The landscape of circulating platelet aggregates in COVID-19;;en;ambito clinico;ambito clinico   ;open;CC-BY-4.0;zip;non classificabile;538600200;2021-07-26
10.5281/zenodo.5139561;A blood atlas of COVID-19 defines hallmarks of disease severity and specificity: Associated data;;low confidence;non definito;non definito;open;CC-BY-4.0;gz,h5ad,pdf,txt;1_star;98179316932;2021-08-17
10.5281/zenodo.5142245;Smarter open government data for Society 5.0: analysis of 51 OGD portals;eng;en;non definito;non definito;open;CC-BY-4.0;csv,ods,txt,xls;3_star;513358;2021-08-04
10.5281/zenodo.5142676;CONCIERGE-CM-UC3M/COVID19-gender-gap;eng;low confidence;non definito;non definito;open;CC-BY-4.0;csv;3_star;2724241580;2021-07-30
10.5281/zenodo.5146019;Pandemic, epidemic, endemic: B cell repertoire analysis reveals unique anti-viral responses to SARS-CoV-2, Ebola and Respiratory Syncytial Virus;;en;ambito genomico;ambito genomico   ;open;CC-BY-4.0;txt;1_star;11625584736;2021-08-30
10.5281/zenodo.5147888;Risk of bias assessments and support for judgement with ROB 2 tool for the Cochrane Review: Remdesivir for the treatment of COVID-19;;en;non definito;non definito;open;CC-BY-4.0;xlsm;trascurato;0;2021-07-30
10.5281/zenodo.5147901;Multiply improved positive matrix factorization for source apportionment of volatile organic compounds during the COVID-19 shutdown in Tianjin, China;;en;non definito;non definito;open;CC-BY-4.0;xlsx;2_star;40673671;2021-09-25
10.5281/zenodo.5148518;In silico study  for screening of natural phytochemicals and metformin as a potential inhibitor of interleukin 6 as target for covid-19;;en;ambito clinico;ambito clinico   ;open;CC-BY-4.0;docx;2_star;33658658;2021-09-25
10.5281/zenodo.5148932;Chest CT Computerized Aided Quantification of PNEUMONIA Lesions in COVID-19 Infection: A Comparison among Three Commercial Software.;;low confidence;non definito;non definito;open;CC-BY-4.0;xlsx;2_star;272923;2021-07-31
10.5281/zenodo.5148943;Coronavirus Disease 2019 (COVID-19) in Italy: features on Chest Computed Tomography using a structured report system;;en;non definito;non definito;open;CC-BY-4.0;xlsx;2_star;75876;2021-07-31
10.5281/zenodo.5153261;MD simulations of SARS-CoV-2 Spike Protein under static electric fields;;en;non definito;non definito;open;CC-BY-4.0;zip;non classificabile;811801577;2021-09-22
10.5281/zenodo.5154535;Decreased aviation leads to increased ice crystal number and a positive radiative effect;;en;non definito;non definito;open;CC-BY-4.0;rar,zip;non classificabile;104139657858;2021-08-04
10.5281/zenodo.5155770;Risk of bias assessments and support for judgement with ROB 2 tool for the Cochrane Review: Systemic corticosteroids for the treatment of COVID-19.;;en;non definito;non definito;open;CC-BY-4.0;xlsm;trascurato;14111997;2021-08-03
10.5281/zenodo.5157016;Source data for Neutralization of SARS-CoV-2 variants by convalescent and BNT162b2 vaccinated serum;eng;en;ambito clinico;ambito clinico   ;open;CC-BY-4.0;xlsx;2_star;839530;2021-08-27
10.5281/zenodo.5159018;Food riots and food prices in the Eastern Mediterranean (Bilād al-Shām) in the 19th and 20th centuries: a data set;;en;non definito;non definito;open;CC-BY-SA-4.0;zip;non classificabile;44093508;2021-08-10
10.5281/zenodo.5159915;Risk of bias assessments for the Cochrane review 'SARS-CoV-2-neutralising monoclonal antibodies for treatment of COVID-19';;low confidence;non definito;non definito;open;CC-BY-4.0;xlsm;trascurato;3313708;2021-08-05
10.5281/zenodo.5162327;No More Dance Floors: COVID-19 and the Dance Music Industry;;low confidence;non definito;non definito;open;CC-BY-4.0;xlsx;2_star;73674;2021-08-05
10.5281/zenodo.5165334;Data: Ongoing mitigation strategies and further needs of the United States food industry to control COVID-19 in the work environment;;en;non definito;non definito;open;other-open;zip;non classificabile;0;2021-08-06
10.5281/zenodo.5167597;COVID-19 Data;;low confidence;non definito;non definito;open;CC-BY-4.0;csv;3_star;229997068;2021-08-07
10.5281/zenodo.5169872;R1A-R1AB-SPYKE-ACE2_Dataset;eng;low confidence;non definito;non definito;open;CC-BY-4.0;png,xls;2_star;802827;2021-08-09
10.5281/zenodo.5170605;A suburban soundscape reveals altered acoustic dynamics during COVID-19 lockdown;eng;en;non definito;non definito;open;other-open;zip;non classificabile;1257282;2021-08-09
10.5281/zenodo.5173788;Nafamostat-interferon-alpha combination suppresses SARS-CoV-2 infection by targeting cooperatively host TMPRSS2 in vitro and in vivo;;low confidence;non definito;non definito;open;CC-BY-4.0;xlsx;2_star;20397625;2021-08-10
10.5281/zenodo.5175868;Coffee Consumption per Capita and Covid-19 Mortality Rate;;en;non definito;non definito;open;CC-BY-4.0;jpg,xlsx;2_star;740354;2021-08-19
10.5281/zenodo.5176085;Risk-perception, attitudes and behavioural intentions to spend on experiences in the post-Corona crisis: data from Italy, Denmark, China and Japan;;en;ambito psicologico;ambito informatico   ;open;CC-BY-4.0;csv,docx,sav;3_star;29544969;2021-08-24
10.5281/zenodo.5176347;Training data for 'Upload data to ENA' (Galaxy Training Material);;en;non definito;non definito;open;CC-BY-4.0;gz,xlsx;2_star;1683237863;2021-08-11
10.5281/zenodo.5185912;SARS-CoV-2 TREE DATA;;low confidence;non definito;non definito;open;CC-BY-4.0;nhx;trascurato;2544;2021-08-12
10.5281/zenodo.5189263;SARS-CoV-2 raw fastq files;;low confidence;non definito;non definito;open;CC-BY-4.0;gz;non classificabile;2269312090;2021-08-13
10.5281/zenodo.5193932;COVID19.BR: A Dataset of Misinformation about COVID-19 in Brazilian Portuguese WhatsApp Messages;;low confidence;non definito;non definito;open;CC-BY-4.0;csv;3_star;964495913;2021-08-13
10.5281/zenodo.5199517;Datasets Cured and Enriched with Provenance from the National Vaccination Campaign Against COVID-19;por;en;non definito;non definito;open;CC-BY-4.0;csv,pdf,ttl,txt,xml,zip;3_star;1021063004;2021-08-14
10.5281/zenodo.5201672;Casos de COVID 19 en el municipio Cerro, La Habana (marzo 2020- marzo 2021);;es;non definito;non definito;open;CC-BY-4.0;csv;3_star;55534296;2021-08-14
10.5281/zenodo.5201766;CoronaNetDataScience/corona_tscs: Releasing new data fields in event dataset;;en;ambito epidemiologico;ambito clinico   ;open;CC-BY-4.0;zip;non classificabile;418342620;2021-08-15
10.5281/zenodo.5202738;Persons and Names of the Middle Kingdom;eng;en;altro;ambito informatico   ;open;CC-BY-4.0;pdf,sql,zip;1_star;2143452342;2021-08-15
10.5281/zenodo.5203138;Banana Per Capita Consumption and SARS-CoV-2 Mortality Rates;;en;ambito genomico;ambito genomico   ;open;CC-BY-4.0;jpg,xlsx;2_star;4814736;2021-08-28
10.5281/zenodo.5203242;Casos de COVID-19 en La Habana y Santiago de Cuba;;es;non definito;non definito;open;CC-BY-4.0;csv;3_star;24652078;2021-08-16
10.5281/zenodo.5207324;Human contact network analytics and COVID-19 hospital incidence in France;;low confidence;non definito;non definito;open;CC-BY-4.0;csv;3_star;105881066;2021-08-18
10.5281/zenodo.5209064;SARS-CoV-2 viral loads across the upper and lower respiratory tract, sex, disease severity and age groups for adult and pediatric COVID-19;;low confidence;non definito;non definito;open;CC-BY-4.0;xlsx;2_star;10253379;2021-08-17
10.5281/zenodo.5213009;GEOS/OCO-2 COVID-19 analysis CO2 fields;;low confidence;non definito;non definito;open;CC-BY-4.0;gz;non classificabile;2235245025;2021-08-18
10.5281/zenodo.5213067;Raw data and heatmaps of VLP deposition modeling;;low confidence;non definito;non definito;open;CC-BY-4.0;pdf,xlsx;2_star;39413515;2021-08-24
10.5281/zenodo.5217335;Covid Data Analytics:  Repositório de Dados Provenientes de Múltiplas Fontes sobre a Pandemia de COVID-19 no Brasil;por;pt;non definito;non definito;open;CC-BY-4.0;zip;non classificabile;569955526;2021-08-19
10.5281/zenodo.5217386;COVID19 Flow-Maps Daily Cases Reports;;low confidence;non definito;non definito;open;CC-BY-4.0;zip;non classificabile;210752736;2021-09-16
10.5281/zenodo.5226312;COVID19 Flow-Maps Daily-Mobility (Maestra 1);;en;non definito;non definito;open;CC-BY-4.0;zip;non classificabile;6492122444;2021-09-16
10.5281/zenodo.5226351;COVID19 Flow-Maps Population data (Maestra 2);;en;non definito;non definito;open;CC-BY-4.0;zip;non classificabile;80613640;2021-09-16
10.5281/zenodo.5226513;bsc-flowmaps/fm-mobility-associated-risk: Second release;;en;altro;ambito epidemiologico   ;open;CC-BY-4.0;zip;non classificabile;2700338817;2021-08-20
10.5281/zenodo.5232499;Coarse-grained molecular dynamics simulations of SARS-CoV-2 envelope protein E in the pentameric form;eng;low confidence;non definito;non definito;open;CC-BY-4.0;zip;non classificabile;22757462926;2021-08-24
10.5281/zenodo.5236428;EFFECT OF FRENCH MARITIME PINE BARK EXTRACT ON ATTENTION-DEFICIT HYPERACTIVITY DISORDER:  A RANDOMIZED CLINICAL TRIAL.;eng;en;ambito psicologico;ambito epidemiologico   ;open;CC-BY-4.0;sav,xlsx;2_star;3037795;2021-08-24
10.5281/zenodo.5236816;Mass Spectrometry Datasets for Highly synergistic combinations of nanobodies that target SARS-CoV-2 and are resistant to escape;;en;non definito;non definito;open;CC-BY-4.0;zip;non classificabile;72784324879;2021-08-25
10.5281/zenodo.5237328;Model-driven mitigation measures for reopening schools during the COVID-19 pandemic.;;en;non definito;non definito;open;CC-BY-4.0;csv,gz;3_star;5210739679;2021-08-24
10.5281/zenodo.5237443;Proactive COVID-19 testing in a partially vaccinated population.;;en;non definito;non definito;open;CC-BY-4.0;csv,gz,py;3_star;648788217;2021-08-24
10.5281/zenodo.5256368;"Nsp3 macrodomain of SARS-CoV-2 ; A Target Enabling Package";;en;non definito;non definito;open;CC-BY-4.0;pdf;1_star;95033322;2021-08-25
10.5281/zenodo.5266426;Code related to article The antibody response to SARS-CoV-2 infection persists over at least 8 months in symptomatic patients;;en;non definito;non definito;open;CC-BY-4.0;ipynb,rtf;trascurato;1117181;2021-08-26
10.5281/zenodo.5269116;Dataset related to article COVID-19 and Lombardy: TESTing the impact of the first wave of the pandemic;eng;en;non definito;non definito;open;CC-BY-4.0;xlsx;2_star;105690;2021-09-06
10.5281/zenodo.5271750;COV-BHP - Psychological Impact of the COVID-19 Outbreak on Health Professionals;eng;en;ambito psicologico;ambito psicologico   ;open;CC-BY-4.0;csv;3_star;4266340;2021-08-27
10.5281/zenodo.5295146;Covid-19 Level Of Preparedness Data;eng;en;non definito;non definito;open;CC-BY-4.0;xlsx;2_star;542430;2021-08-28
10.5281/zenodo.5297699;Epistasis at the SARS-CoV-2 RBD Interface and the Propitiously Boring Implications for Vaccine Escape;;low confidence;non definito;non definito;open;CC-BY-4.0;dat,gz,tgz;1_star;403134958;2021-08-28
10.5281/zenodo.5307070;Simulated wastewater sequencing data for benchmarking SARS-CoV-2 variant abundance estimation;;en;ambito informatico;ambito genomico   ;open;CC-BY-4.0;gz;non classificabile;23395293021;2021-08-31
10.5281/zenodo.5335924;PENINGKATAN SADDHA UMAT BUDDHA NICHIREN  SHOSHU DI JAWA TENGAH  PADA MASA PANDEMI COVID 19;ind;low confidence;non definito;non definito;open;CC-BY-4.0;pdf;1_star;1146642;2021-08-31
10.5281/zenodo.5338528;Seroprevalence of IgG antibodies against SARS coronavirus 2 in Belgium – a serial prospective cross-sectional nationwide study of residual samples (March – October 2020);eng;en;ambito genomico;ambito genomico   ;open;CC-BY-4.0;csv;3_star;12514320;2021-08-31
10.5281/zenodo.5338985;ANALISIS KEADILAN DALAM PANDEMI COVID 19 DI MASA PEMBERLAKUAN PEMBATASAN KEGIATAN MASYARAKAT (PPKM) DARURAT;ind;low confidence;non definito;non definito;open;CC-BY-4.0;pdf;1_star;622410;2021-08-31
10.5281/zenodo.5338987;Penerapan Digitalisasi Data dan Informasi era Pandemi  di Desa Dangin Puri Kangin Denpasar;;id;non definito;non definito;open;CC-BY-4.0;pdf;1_star;1029252;2021-08-31
